cho_meet_1958_2578_000_0000;France after the Referendum;8/2578;English
cho_meet_1958_2579_000_0000;The B.B.C's External Services;8/2579;English
cho_meet_1958_2580_000_0000;Hong Kong: Present and Future;8/2580;English
cho_meet_1958_2581_000_0000;China and the World;8/2581;English
cho_meet_1958_2582_000_0000;The Invisible College;8/2582;English
cho_meet_1958_2584_000_0000;Aid to Under-Developed Countries – The Role of the West;8/2584;English
cho_meet_1958_2585_000_0000;Some Impressions of French West Africa;8/2585;English
cho_meet_1958_2586_000_0000;Far Eastern Group: The Background to the Indonesian Problem;8/2586;English
cho_meet_1958_2587_000_0000;Far Eastern Group: Control Mechanisms in Communist China , and How they Work;8/2587;English
cho_meet_1958_2590_000_0000;Far Eastern Group: Japan as an International Power;8/2590;English
cho_meet_1958_2593_000_0000;Far Eastern Group: Economic Reconstruction and the Struggle for Political Power in Indonesia;8/2593;English
cho_meet_1958_2594_000_0000;Far Eastern Group: Nepal Today;8/2594;English
cho_meet_1958_2595_000_0000;Far Eastern Group: The Relationship Between the Burmese and the States in Burma;8/2595;English
cho_meet_1958_2596_000_0000;Middle East Group: Impressions After Visiting UNEF;8/2596;English
cho_meet_1958_2597_000_0000;Middle East Group: Storm Clouds over the Horn of Africa;8/2597;English
cho_meet_1958_2598_000_0000;Middle East Group: Is there a Separate Culture Yet in Israel?;8/2598;English
cho_meet_1958_2599_000_0000;Middle East Group: The Recent Situation in Persia;8/2599;English
cho_meet_1958_2600_000_0000;Middle East Group: Contemporary Lebanese Politics;8/2600;English
cho_meet_1958_2601_000_0000;Middle East Group: Insoluble Cyprus?;8/2601;English
cho_meet_1958_2603_000_0000;Middle East Group: Recent Developments in Iran;8/2603;English
cho_meet_1958_2606_000_0000;Some Aspects of Monetary Stability in an Expanding Economy;8/2606;English
cho_meet_1959_2604_000_0000;The South African Treason Trials;8/2604;English
cho_meet_1959_2605_000_0000;Pakistan Today;8/2605;English
cho_meet_1959_2607_000_0000;Poland's Quest for European Security;8/2607;English
cho_meet_1959_2608_000_0000;German Foreign Policy: Foundations in the West - Aims in the East;8/2608;English
cho_meet_1959_2609_000_0000;Recent Trends in Yugoslavia;8/2609;English
cho_meet_1959_2610_000_0000;The Future Basis of European Economic Relations;8/2610;English
cho_meet_1959_2611_000_0000;The Outlook in Algeria;8/2611;English
cho_meet_1959_2612_000_0000;Russia and the Middle East;8/2612;English
cho_meet_1959_2613_000_0000;Accra, Cairo and Africa;8/2613;English
cho_meet_1959_2614_000_0000;La Crise Francaise De 1945 a 1959;8/2614;French
cho_meet_1959_2615_000_0000;The Multi-Racial Experiment in British Africa;8/2615;English
cho_meet_1959_2616_000_0000;The Outlook for the Fifth Republic;8/2616;English
cho_meet_1959_2617_000_0000;Ceylon: The Political and Economic Picture;8/2617;English
cho_meet_1959_2618_000_0000;Crisis in Central Africa;8/2618;English
cho_meet_1959_2619_000_0000;The Arab World and Britain;8/2619;English
cho_meet_1959_2620_000_0000;The French Army Today as a Political and Social Factor;8/2620;English
cho_meet_1959_2621_000_0000;The Future of European Economic Cooperation;8/2621;English
cho_meet_1959_2622_000_0000;The Present Situation in Kenya Politics;8/2622;English
cho_meet_1959_2623_000_0000;The Berlin Crisis;8/2623;English
cho_meet_1959_2624_000_0000;The Future of the Commonwealth;8/2624;English
cho_meet_1959_2625_000_0000;German Public Opinion and the Berlin Crisis;8/2625;English
cho_meet_1959_2626_000_0000;Soviet-Chinese Relations;8/2626;English
cho_meet_1959_2627_000_0000;Recent Developments in Spain;8/2627;English
cho_meet_1959_2628_000_0000;The European Monetary Agreement: Its Structure and Working;8/2628;English
cho_meet_1959_2629_000_0000;Kenya Prospects;8/2629;English
cho_meet_1959_2630_000_0000;China and the Succession to Mao Tse-Tung;8/2630;English
cho_meet_1959_2631_000_0000;Prospects for the Fifth Republic;8/2631;English
cho_meet_1959_2632_000_0000;Disarmament, Europe and Security;8/2632;English
cho_meet_1959_2633_000_0000;Pakistan After the Revolution;8/2633;English
cho_meet_1959_2634_000_0000;The Problem of the Federation of Rhodesia and Nyasaland;8/2634;English
cho_meet_1959_2635_000_0000;Japan's Foreign Policy: Western Alliance or Neutrality?;8/2635;English
cho_meet_1959_2636_000_0000;Impressions From Eastern Europe;8/2636;English
cho_meet_1959_2637_000_0000;Tibet;8/2637;English
cho_meet_1959_2638_000_0000;Tanganyika;8/2638;English
cho_meet_1959_2639_000_0000;Impressions of Kerala;8/2639;English
cho_meet_1959_2640_000_0000;The Federation Today;8/2640;English
cho_meet_1959_2641_000_0000;Continuity and Change in Indian Foreign Policy;8/2641;English
cho_meet_1959_2642_000_0000;The Federation of Rhodesia and Nyasaland;8/2642;English
cho_meet_1959_2643_000_0000;The Background to the Current Situation in Indo-China;8/2643;English
cho_meet_1959_2644_000_0000;The French Sahara;8/2644;English
cho_meet_1959_2645_000_0000;The Party Struggle in Israel;8/2645;English
cho_meet_1959_2646_000_0000;Planning and Management of Socialist Economy in Poland;8/2646;English
cho_meet_1959_2647_000_0000;The Outlook in East and Central Africa;8/2647;English
cho_meet_1959_2648_000_0000;Yugoslav-Soviet Bloc Relations in the Event of International Detente;8/2648;English
cho_meet_1959_2649_000_0000;British-Soviet Cultural Relations;8/2649;English
cho_meet_1959_2650_000_0000;The Republic of Guinea;8/2650;English
cho_meet_1959_2651_000_0000;The Myth of British Colonial Exploitation;8/2651;English
cho_meet_1959_2652_000_0000;Southern Rhodesia;8/2652;English
cho_meet_1959_2654_000_0000;The 'Outer Seven';8/2654;English
cho_meet_1959_2655_000_0000;A Plea For Reconstruction of Indian Polity;8/2655;English
cho_meet_1959_2656_000_0000;Nyasaland Looks to the Future;8/2656;English
cho_meet_1959_2657_000_0000;Political Trends in the Sudan;8/2657;English
cho_meet_1959_2658_000_0000;Hungary;8/2658;English
cho_meet_1959_2659_000_0000;The Approach to the Summit (BBC 'Radio Link' Programme);8/2659;English
cho_meet_1959_2660_000_0000;Far Eastern Group: Developments in Taiwan;8/2660;English
cho_meet_1959_2663_000_0000;Far Eastern Group: Recent Developments in ceylon;8/2663;English
cho_meet_1959_2664_000_0000;Far Eastern Group: The Chinese Overseas;8/2664;English
cho_meet_1959_2665_000_0000;Far Eastern Group: Whither Singapore;8/2665;English
cho_meet_1959_2666_000_0000;Far Eastern Group: Recent Developments in South Vietnam;8/2666;English
cho_meet_1959_2667_000_0000;Middle East Group: Some Recent Impressions from Cairo and Baghdad;8/2667;English
cho_meet_1959_2668_000_0000;Middle East Group: His Excellency Samir Rifai, Prime Minister of Jordan;8/2668;English
cho_meet_1959_2669_000_0000;Middle East Group: Impressions of Turkey and the Lebanon;8/2669;English
cho_meet_1959_2670_000_0000;Middle East Group: The Outlook in the Middle East;8/2670;English
cho_meet_1959_2671_000_0000;Middle East Group: International Politics in the Postwar Middle East;8/2671;English
cho_meet_1959_2707_000_0000;Iraq Since the Revolution;8/2707;English
cho_meet_1960_2672_000_0000;1960 in Central Africa;8/2672;English
cho_meet_1960_2673_000_0000;The 'Six', the 'Seven', and German Economic and Foreign Policy;8/2673;English
cho_meet_1960_2674_000_0000;An Opposition View of Problems in the Federation;8/2674;English
cho_meet_1960_2675_000_0000;New Forces in the United Nations;8/2675;English
cho_meet_1960_2676_000_0000;Israel's Foreign Relations;8/2676;English
cho_meet_1960_2677_000_0000;European Unity and Germany;8/2677;English
cho_meet_1960_2678_000_0000;The Antarctic Treaty;8/2678;English
cho_meet_1960_2679_000_0000;The Middle East, Israel and the Western Powers;8/2679;English
cho_meet_1960_2680_000_0000;Latin America: The Changing Scene;8/2680;English
cho_meet_1960_2681_000_0000;Anti-Semitism and the Neo-Nazi Revival;8/2681;English
cho_meet_1960_2682_000_0000;The Kenya Constitutional Conference;8/2682;English
cho_meet_1960_2683_000_0000;The Presidential Campaign in the United States of America;8/2683;English
cho_meet_1960_2684_000_0000;France and Algeria;8/2684;English
cho_meet_1960_2685_000_0000;The 'Seven', the 'Six', and North America;8/2685;English
cho_meet_1960_2686_000_0000;Transition in the Belgian Congo;8/2686;English
cho_meet_1960_2687_000_0000;Rules of Competition in a Common Market: The Example of the European Coal and Steel Community;8/2687;English
cho_meet_1960_2688_000_0000;British Commonwealth Relations Meeting;8/2688;English
cho_meet_1960_2689_000_0000;Soviet Foreign Policy on the Eve of the Summit;8/2689;English
cho_meet_1960_2690_000_0000;The Formulation of American Foreign Policy;8/2690;English
cho_meet_1960_2691_000_0000;La Scene Politique En Itaie;8/2691;French
cho_meet_1960_2692_000_0000;Christian Tensions in South Africa;8/2692;English
cho_meet_1960_2693_000_0000;Western Policy and the Summit;8/2693;English
cho_meet_1960_2694_000_0000;Les Methodes Politiques Du General De Gaulle;8/2694;French
cho_meet_1960_2695_000_0000;The European Community: Challenge to Britain;8/2695;English
cho_meet_1960_2696_000_0000;The Work of the International Monetary Fund;8/2696;English
cho_meet_1960_2697_000_0000;South Africa Today;8/2697;English
cho_meet_1960_2698_000_0000;Britain's Position in Egypt and the Persian Gulf;8/2698;English
cho_meet_1960_2699_000_0000;Western Defence in the 1960s;8/2699;English
cho_meet_1960_2700_000_0000;Impressions of Afghanistan, Pakistan, and India, in Relation to the Communist World;8/2700;English
cho_meet_1960_2701_000_0000;International Aspects of Atomic Industry;8/2701;English
cho_meet_1960_2702_000_0000;The European Economic Situation;8/2702;English
cho_meet_1960_2703_000_0000;Soviet Asia: Education and the New Imperialism;8/2703;English
cho_meet_1960_2704_000_0000;South Africa: The Emergency and After;8/2704;English
cho_meet_1960_2705_000_0000;Inter-State Relations in the West African Region;8/2705;English
cho_meet_1960_2706_000_0000;Kenya and its Economy Today;8/2706;English
cho_meet_1960_2708_000_0000;The Challenge of the Underdeveloped World;8/2708;English
cho_meet_1960_2709_000_0000;Kenya;8/2709;English
cho_meet_1960_2710_000_0000;Italy, Britain and European Unity;8/2710;English
cho_meet_1960_2711_000_0000;The Turkish Revolution;8/2711;English
cho_meet_1960_2712_000_0000;The Precedent of the Congo;8/2712;English
cho_meet_1960_2713_000_0000;The United States and the Middle East;8/2713;English
cho_meet_1960_2714_000_0000;Politics in South Africa After the Referendum;8/2714;English
cho_meet_1960_2715_000_0000;The Monckton Commission Report;8/2715;English
cho_meet_1960_2716_000_0000;Social Infrastructure of the Congo;8/2716;English
cho_meet_1960_2717_000_0000;The New President of the United States of America;8/2717;English
cho_meet_1960_2718_000_0000;South Africa and the Commonwealth;8/2718;English
cho_meet_1960_2719_000_0000;Some Reflections on India;8/2719;English
cho_meet_1960_2720_000_0000;The Crisis of the Commonwealth 1960;8/2720;English
cho_meet_1960_2721_000_0000;Prospects in the Middle East;8/2721;English
cho_meet_1960_2722_000_0000;The South African Problem;8/2722;English
cho_meet_1960_2723_000_0000;Germany, Poland and European Security;8/2723;English
cho_meet_1960_2724_000_0000;Nations in the Making - Reflections on the West Indies and British Guiana;8/2724;English
cho_meet_1960_2725_000_0000;Far Eastern Group: Agricultural Progress in S.E. Asia;8/2725;English
cho_meet_1960_2726_000_0000;Far Eastern Group: Political Trends in Indonesia;8/2726;English
cho_meet_1960_2727_000_0000;Far Eastern Group: Developments in Mongolia;8/2727;English
cho_meet_1960_2728_000_0000;Far Eastern Group: The Political Extremes in Japan;8/2728;English
cho_meet_1960_2729_000_0000;Far Eastern Group: The Changing Nature of Burmese Politics;8/2729;English
cho_meet_1960_2730_000_0000;Far Eastern Group: The Nature of Japanese Politics;8/2730;English
cho_meet_1960_2732_000_0000;Far Eastern Group: China's Industrial Development;8/2732;English
cho_meet_1960_2733_000_0000;Far Eastern Group: The Nature of Politics in the Philippines;8/2733;English
cho_meet_1960_2734_000_0000;Far Eastern Group: The Nature of Thai Politics;8/2734;English
cho_meet_1960_2735_000_0000;Far Eastern Group: The Future of Singapore;8/2735;English
cho_meet_1960_2862_000_0000;Discussion on Disarmament;8/2862;English
cho_meet_1961_2736_000_0000;The Federal Structure in a Multi-Racial State;8/2736;English
cho_meet_1961_2737_000_0000;France and Algeria;8/2737;English
cho_meet_1961_2738_000_0000;Contrasts in the British and German Economies;8/2738;English
cho_meet_1961_2739_000_0000;Woodrow Wilson and the Idea of the Nation State;8/2739;English
cho_meet_1961_2740_000_0000;Impressions of Mauritania, Guinea, Mali and Senegal;8/2740;English
cho_meet_1961_2741_000_0000;The Katanga Situation;8/2741;English
cho_meet_1961_2742_000_0000;Parliamentary Democracy and the New Nations;8/2742;English
cho_meet_1961_2743_000_0000;The Indian Problem in Bolivia and Guatemala;8/2743;English
cho_meet_1961_2744_000_0000;Iraq Between Arab Nationalism and Communism;8/2744;English
cho_meet_1961_2745_000_0000;The High Commission Territories in Southern Africa;8/2745;English
cho_meet_1961_2746_000_0000;Technical Assistance and the Expert in the Field;8/2746;English
cho_meet_1961_2747_000_0000;Le Probleme De La Rencontre De L'Europe Et Du Tiers Monde En Afrique;8/2747;French
cho_meet_1961_2748_000_0000;India and Pakistan: Progress and Problems in 1961;8/2748;English
cho_meet_1961_2749_000_0000;The Economic and Social Background to Migration from Jamaica to the United Kingdom;8/2749;English
cho_meet_1961_2750_000_0000;The Situation of the European Settler in Kenya;8/2750;English
cho_meet_1961_2751_000_0000;The United Nations Operation in the Congo;8/2751;English
cho_meet_1961_2752_000_0000;Islamic Law and Modern Life: Attempts At Reconciliation;8/2752;English
cho_meet_1961_2753_000_0000;Turkish Politics, 1960-61;8/2753;English
cho_meet_1961_2754_000_0000;Substance and Limits of the Sino-Soviet Dispute;8/2754;English
cho_meet_1961_2755_000_0000;Ethiopia Revisited;8/2755;English
cho_meet_1961_2756_000_0000;Germany and Poland;8/2756;English
cho_meet_1961_2757_000_0000;New Towns and Industries in the Southern Negev;8/2757;English
cho_meet_1961_2758_000_0000;Could Britain Join the Common Market?;8/2758;English
cho_meet_1961_2759_000_0000;The Situation in Algeria;8/2759;English
cho_meet_1961_2760_000_0000;The Outlook for Africa;8/2760;English
cho_meet_1961_2761_000_0000;Discussion of World Government;8/2761;English
cho_meet_1961_2762_000_0000;Angola Background;8/2762;English
cho_meet_1961_2763_000_0000;Britain and the Six: The Next Stage;8/2763;English
cho_meet_1961_2764_000_0000;The Foreign Policy of Mali;8/2764;English
cho_meet_1961_2765_000_0000;Greece Today;8/2765;English
cho_meet_1961_2766_000_0000;Impressions of the Moscow Trade Fair;8/2766;English
cho_meet_1961_2767_000_0000;Katanga, Belgium and the United Nations;8/2767;English
cho_meet_1961_2768_000_0000;The Federation of Rhodesia and Nyasaland - the African Affairs Board;8/2768;English
cho_meet_1961_2769_000_0000;Some Aspects of European Integration;8/2769;English
cho_meet_1961_2770_000_0000;The Press and International Tensions;8/2770;English
cho_meet_1961_2771_000_0000;The Outlook in Kenya;8/2771;English
cho_meet_1961_2772_000_0000;Middle East Petroleum;8/2772;English
cho_meet_1961_2773_000_0000;Decolonisation: The Last Stages;8/2773;English
cho_meet_1961_2774_000_0000;Congo Personalities;8/2774;English
cho_meet_1961_2776_000_0000;Some Aspects of the Congo Problem;8/2776;English
cho_meet_1961_2777_000_0000;Nigeria: June 1961;8/2777;English
cho_meet_1961_2778_000_0000;The United States' View of East-West Relations;8/2778;English
cho_meet_1961_2779_000_0000;The Situation in East Germany and the Berlin Problem;8/2779;English
cho_meet_1961_2780_000_0000;Le General De Gaulle Et La Resistance Francaise;8/2780;French
cho_meet_1961_2781_000_0000;The British Application for Common Market Membership;8/2781;English
cho_meet_1961_2782_000_0000;The Principles of Senegalese Foreign Policy;8/2782;English
cho_meet_1961_2783_000_0000;Great Britain and the United States: Past, Present and Future;8/2783;English
cho_meet_1961_2784_000_0000;Current Political Events in Nyasaland;8/2784;English
cho_meet_1961_2785_000_0000;L'Evolution Et Les Buts De La Communaute Europeenne;8/2785;French
cho_meet_1961_2786_000_0000;The Background to and Possible Future Events in Ghana;8/2786;English
cho_meet_1961_2787_000_0000;Brazil at the Crossroads Again;8/2787;English
cho_meet_1961_2788_000_0000;The Outlook for the South African Republic;8/2788;English
cho_meet_1961_2789_000_0000;Kennedy in the Presidency;8/2789;English
cho_meet_1961_2790_000_0000;A French View of European Integration;8/2790;English
cho_meet_1961_2791_000_0000;The Crisis in Europe;8/2791;English
cho_meet_1961_2792_000_0000;Finland's Foreign Policy;8/2792;English
cho_meet_1961_2793_000_0000;The Soviet Impact on West Africa;8/2793;English
cho_meet_1961_2794_000_0000;Migration;8/2794;English
cho_meet_1961_2795_000_0000;The Problem of a Common Agricultural Policy in Europe;8/2795;English
cho_meet_1961_2796_000_0000;Recent Events in Ghana and the Congo Crisis;8/2796;English
cho_meet_1961_2797_000_0000;Far Eastern Group: Japanese Politics and the Approach of Prosperity;8/2797;English
cho_meet_1961_2798_000_0000;Far Eastern Group: Where Power Lies in Japan;8/2798;English
cho_meet_1961_2799_000_0000;Far Eastern Group: North Vietnam;8/2799;English
cho_meet_1961_2800_000_0000;Far Eastern Group: Thailand'S Present Position in South East Asia;8/2800;English
cho_meet_1962_2801_000_0000;The Constitutional Evolution of Pakistan;8/2801;English
cho_meet_1962_2802_000_0000;India's Foreign Policy;8/2802;English
cho_meet_1962_2803_000_0000;The University as a Vehicle of Integration in the Federation of Rhodesia and Nyasaland;8/2803;English
cho_meet_1962_2804_000_0000;A German View of European Integration;8/2804;English
cho_meet_1962_2805_000_0000;Ghana,1962;8/2805;English
cho_meet_1962_2806_000_0000;Recent Political Developments in Turkey;8/2806;English
cho_meet_1962_2807_000_0000;Kenya's Future as Seen by K. A. D. U;8/2807;English
cho_meet_1962_2808_000_0000;East/West Relations as Seen from Germany;8/2808;English
cho_meet_1962_2809_000_0000;Kenya in Transition;8/2809;English
cho_meet_1962_2810_000_0000;Financial and Monetary Cooperation in the Common Market;8/2810;English
cho_meet_1962_2811_000_0000;Indonesia: The Prospects;8/2811;English
cho_meet_1962_2812_000_0000;A Report on the 16th Session of the United Nations;8/2812;English
cho_meet_1962_2813_000_0000;Discussion on the Future of the Commonwealth;8/2813;English
cho_meet_1962_2814_000_0000;Impressions of Cuba;8/2814;English
cho_meet_1962_2815_000_0000;Impressions of the United Arab Republic in December 1961;8/2815;English
cho_meet_1962_2816_000_0000;Kenya's New Constitution;8/2816;English
cho_meet_1962_2817_000_0000;Problems of Membership and Association with the European Economic Community;8/2817;English
cho_meet_1962_2818_000_0000;Towards Malaysia;8/2818;English
cho_meet_1962_2819_000_0000;The United Nations in the Congo;8/2819;English
cho_meet_1962_2821_000_0000;The Outlook for the Rhodesian Federation;8/2821;English
cho_meet_1962_2822_000_0000;The Role of German Trade Unions in Modern Society;8/2822;English
cho_meet_1962_2823_000_0000;The Organisation of Commonwealth Relations;8/2823;English
cho_meet_1962_2824_000_0000;The Common Market's Agricultural Policy;8/2824;English
cho_meet_1962_2825_000_0000;Present Trends in the Racial Situation in South Africa;8/2825;English
cho_meet_1962_2827_000_0000;The Federation of Rhodesia and Nyasaland - the Present Challenge;8/2827;English
cho_meet_1962_2828_000_0000;German Overseas Development Aid;8/2828;English
cho_meet_1962_2829_000_0000;The Association of Overseas Countries as a Common Market Problem;8/2829;English
cho_meet_1962_2830_000_0000;Recent Trends in Nyasaland;8/2830;English
cho_meet_1962_2831_000_0000;Israel and the Arab Blockade;8/2831;English
cho_meet_1962_2832_000_0000;Britain, the U.S.A and Psychological Decolonisation;8/2832;English
cho_meet_1962_2833_000_0000;Southern Rhodesia - the Next Eighteen Months;8/2833;English
cho_meet_1962_2834_000_0000;The Situation in South-East Asia;8/2834;English
cho_meet_1962_2835_000_0000;The Political Situation in Iran;8/2835;English
cho_meet_1962_2836_000_0000;Southern Rhodesia - Change and Progress;8/2836;English
cho_meet_1962_2837_000_0000;The Basic Principles of Soviet Foreign Policy;8/2837;English
cho_meet_1962_2838_000_0000;The Problem of the United Kingdom'S EFTA Partners;8/2838;English
cho_meet_1962_2839_000_0000;The Commonwealth and an Atlantic Community;8/2839;English
cho_meet_1962_2840_000_0000;Decision-Making and Executive Action in a Changing United Nations;8/2840;English
cho_meet_1962_2841_000_0000;Keeping the Peace: New Armies and International Forces;8/2841;English
cho_meet_1962_2843_000_0000;The Congo and the United Nations;8/2843;English
cho_meet_1962_2844_000_0000;The Political Case Against British Membership of the E. E. C;8/2844;English
cho_meet_1962_2845_000_0000;Germany Since the Elections;8/2845;English
cho_meet_1962_2846_000_0000;The Present State of the Commonwealth;8/2846;English
cho_meet_1962_2847_000_0000;The Present Situation in Thailand;8/2847;English
cho_meet_1962_2848_000_0000;Black-White Relationship in Independent West Africa;8/2848;English
cho_meet_1962_2849_000_0000;An Indigestible Satellite - Soviet Rebuffs in East Germany;8/2849;English
cho_meet_1962_2850_000_0000;Economic Problems and Prospects in Egypt;8/2850;English
cho_meet_1962_2851_000_0000;Current Experiments in Racial Association in South Africa and Southern Rhodesia;8/2851;English
cho_meet_1962_2852_000_0000;Towards a European Parliament;8/2852;English
cho_meet_1962_2853_000_0000;Manning the New East African States;8/2853;English
cho_meet_1962_2854_000_0000;Impressions of Relief Work in Jordan and the Emergent Pattern of Society;8/2854;English
cho_meet_1962_2855_000_0000;The Chinese Approach to International Affairs;8/2855;English
cho_meet_1962_2856_000_0000;Portugal's African Territories: Present Realities;8/2856;English
cho_meet_1962_2857_000_0000;The Mass Media of Communication - a Factor in Economic and Social Development;8/2857;English
cho_meet_1962_2858_000_0000;The Persian Land Reform;8/2858;English
cho_meet_1962_2860_000_0000;Cuba;8/2860;English
cho_meet_1962_2861_000_0000;Re-Thinking Rhodesia;8/2861;English
cho_meet_1962_2863_000_0000;Problems of Western Commodity Policy;8/2863;English
cho_meet_1962_2864_000_0000;Political Aspects of European Unity;8/2864;English
cho_meet_1962_2865_000_0000;Some Aspects of Vatican Policies from plus IX. to John XXIII;8/2865;English
cho_meet_1962_2866_000_0000;Trinidad Faces Independence;8/2866;English
cho_meet_1962_2867_000_0000;Some Thoughts on the United Nations and Africa;8/2867;English
cho_meet_1962_2868_000_0000;Far Eastern Group: Mongolia;8/2868;English
cho_meet_1962_2869_000_0000;Far Eastern Group: Guided Democracy in Indonesia;8/2869;English
cho_meet_1962_2913_000_0000;The Conflict in the Yemen;8/2913;English
cho_meet_1963_2820_000_0000;Implications of the United Nations Congo Operation;8/2820;English
cho_meet_1963_2870_000_0000;Northern Nigeria: The Road to Self-Government;8/2870;English
cho_meet_1963_2871_000_0000;Science and International Relations;8/2871;English
cho_meet_1963_2872_000_0000;The Political Climate in Latin America;8/2872;English
cho_meet_1963_2873_000_0000;Tanganyika and the East African Common Services Organisation;8/2873;English
cho_meet_1963_2874_000_0000;The Anglican Church in Central Africa;8/2874;English
cho_meet_1963_2875_000_0000;British Policy After the Check in Europe;8/2875;English
cho_meet_1963_2876_000_0000;New Directions in International Economic Assistance;8/2876;English
cho_meet_1963_2877_000_0000;Italy and Europe;8/2877;English
cho_meet_1963_2879_000_0000;India and the Emergency;8/2879;English
cho_meet_1963_2880_000_0000;Kenya's Problems At the Start of 1963;8/2880;English
cho_meet_1963_2881_000_0000;The Rio Conference on Inflation and Growth in Latin America;8/2881;English
cho_meet_1963_2882_000_0000;India after the Chinese Invasion;8/2882;English
cho_meet_1963_2883_000_0000;Hungary's Economic Development Since 1957 and its Implications for Foreign Trade, Especially With Western Countries;8/2883;English
cho_meet_1963_2884_000_0000;The Economic Implications of the Brussels Breakdown;8/2884;English
cho_meet_1963_2885_000_0000;The Strategic Importance of the Nassau Agreement and the Failure of the Brussels Negotiations;8/2885;English
cho_meet_1963_2886_000_0000;France, Europe and the Western World;8/2886;English
cho_meet_1963_2887_000_0000;Freedom of Expression in Southern Rhodesia;8/2887;English
cho_meet_1963_2888_000_0000;Constitutional Developments in the Central African Federation;8/2888;English
cho_meet_1963_2889_000_0000;The Sino-Soviet Dispute and Russia's Relations With the West;8/2889;English
cho_meet_1963_2890_000_0000;Britain and Europe - Some Lessons of Brussels;8/2890;English
cho_meet_1963_2891_000_0000;The New Yugoslavia Constitution;8/2891;English
cho_meet_1963_2892_000_0000;Disarmament Prospects after Cuba;8/2892;English
cho_meet_1963_2893_000_0000;Germany, Europe and the Western Alliance;8/2893;English
cho_meet_1963_2894_000_0000;The Peace-Keeping Role of the United Nations;8/2894;English
cho_meet_1963_2895_000_0000;The Federal Republic of Cameroon;8/2895;English
cho_meet_1963_2896_000_0000;America and Europe;8/2896;English
cho_meet_1963_2897_000_0000;Political Change in the Soviet Union Since Stalin's Death;8/2897;English
cho_meet_1963_2898_000_0000;Impressions of Malaysia;8/2898;English
cho_meet_1963_2899_000_0000;Commonwealth Ties after Brussels;8/2899;English
cho_meet_1963_2900_000_0000;Africa after the African Summit Conference;8/2900;English
