cho_meet_1940_0650_000_0000;The Last Days of the Third Republic in France;8/650;English
cho_meet_1940_0651_000_0000;The Trend of Opinion in the U.S.A. since the Outbreak of War;8/651;English
cho_meet_1940_0652_000_0000;The Terrain in North-East Africa (with Reference to the Present Campaign);8/652;English
cho_meet_1940_0653_000_0000;The Mysterious English;8/653;English
cho_meet_1940_0654_000_0000;The Strategic Situation in the Pacific;8/654;English
cho_meet_1940_0655_000_0000;The Canadian-United States Defence Agreement;8/655;English
cho_meet_1940_0656_000_0000;Hitler's New Economic Order for Europe;8/656;English
cho_meet_1940_0657_000_0000;The War Effort of the Netherlands;8/657;English
cho_meet_1940_0658_000_0000;The Present Situation in India;8/658;English
cho_meet_1940_0659_000_0000;The Present Situation in Spain;8/659;English
cho_meet_1940_0660_000_0000;The Strategic Position of the War;8/660;English
cho_meet_1940_0661_000_0000;The Present Situation in Bulgaria;8/661;English
cho_meet_1940_0662_000_0000;Canada's Part in North-American Policy;8/662;English
cho_meet_1940_0663_000_0000;Indian Opinion;8/663;English
cho_meet_1940_0664_000_0000;Le Mouvement Des Forces Françaises Libres;8/664;French
cho_meet_1940_0665_000_0000;The Effect of History on the Evolution of the German Character;8/665;English
cho_meet_1940_0666_000_0000;Science and the War;8/666;English
cho_meet_1940_0667_000_0000;Ukraine and her People;8/667;English
cho_meet_1940_0668_000_0000;The Czechs Yesterday and Tomorrow;8/668;English
cho_meet_1940_0669_000_0000;The Present Situation in India;8/669;English
cho_meet_1940_0670_000_0000;The Role of the Middle East;8/670;English
cho_meet_1940_0671_000_0000;Germany's Economic Gains in South-Eastern Europe;8/671;English
cho_meet_1940_0672_000_0000;Italy and Greece and Recent Italian Aggression;8/672;English
cho_meet_1940_0673_000_0000;The United States Presidential Election;8/673;English
cho_meet_1940_0674_000_0000;The Civilian Population and Aerial Warfare;8/674;English
cho_meet_1940_0675_000_0000;England and Spain;8/675;English
cho_meet_1940_0676_000_0000;Key Problems in the Eastern Mediterranean;8/676;English
cho_meet_1940_0677_000_0000;The Extension of the Axis to the Far East;8/677;English
cho_meet_1940_0678_000_0000;The Situation and the Spirit of Poland Today;8/678;English
cho_meet_1940_0679_000_0000;War by Revolution;8/679;English
cho_meet_1940_0680_000_0000;The Post War World: Some Pointers towards Reconstruction;8/680;English
cho_meet_1940_0681_000_0000;France Under German Occupation;8/681;English
cho_meet_1940_0682_000_0000;The Flood of Violence and the Dearth of Ideas in Europe;8/682;English
cho_meet_1940_0683_000_0000;Why Hungary Had to Do It;8/683;English
cho_meet_1940_0684_000_0000;An American View of the War;8/684;English
cho_meet_1941_0685_000_0000;Special: Four Discussion meetings on the Political Situation in India;8/685;English
cho_meet_1941_0686_000_0000;Discussion Meeting on the Position of Italy I;8/686;English
cho_meet_1941_0687_000_0000;Albania's Struggle for Independence;8/687;English
cho_meet_1941_0688_000_0000;Church and State: The Roman Catholic Church and World Affairs;8/688;English
cho_meet_1941_0689_000_0000;Norway Under German Occupation;8/689;English
cho_meet_1941_0690_000_0000;The Destruction of Wealth in Europe;8/690;English
cho_meet_1941_0691_000_0000;Islam as an Influence in the War;8/691;English
cho_meet_1941_0692_000_0000;Great Britain's Agricultural Position in the World;8/692;English
cho_meet_1941_0693_000_0000;Problems of Economic Development among a Malay Peasantry;8/693;English
cho_meet_1941_0694_000_0000;Prospects of Anglo-American Collaboration in the War and in the Peace;8/694;English
cho_meet_1941_0695_000_0000;The Position of Switzerland in the War;8/695;English
cho_meet_1941_0696_000_0000;La Situation De La Belgique Dans La Guerre (In French);8/696;French
cho_meet_1941_0697_000_0000;Roumania of Yesterday and To-Morrow;8/697;English
cho_meet_1941_0698_000_0000;Free China;8/698;English
cho_meet_1941_0699_000_0000;Air Strategy;8/699;English
cho_meet_1941_0700_000_0000;The West Indian Outlook on the International Situation;8/700;English
cho_meet_1941_0701_000_0000;The 'Lease and Lend Bill' and its Significance;8/701;English
cho_meet_1941_0702_000_0000;The Last Seventeen Months in Bilbao;8/702;English
cho_meet_1941_0703_000_0000;The Financial and Economic Rehabilitation of Europe after the War;8/703;English
cho_meet_1941_0704_000_0000;Norway from within;8/704;English
cho_meet_1941_0705_000_0000;Abyssinia and the Future;8/705;English
cho_meet_1941_0706_000_0000;La France Aujourd'Hui (In French);8/706;French
cho_meet_1941_0707_000_0000;Japan and the Far Eastern Situation;8/707;English
cho_meet_1941_0708_000_0000;"L'Apres Guerre Et Les Petites Nations (In French; and English Translation)";8/708;French, English
cho_meet_1941_0709_000_0000;Nazi Activities in Latin America;8/709;English
cho_meet_1941_0710_000_0000;Blockade and Counter Blockade;8/710;English
cho_meet_1941_0711_000_0000;Germany as a Spiritual and World Problem;8/711;English
cho_meet_1941_0712_000_0000;Three Points for a Future Italy;8/712;English
cho_meet_1941_0713_000_0000;Canada and the North Atlantic World;8/713;English
cho_meet_1941_0714_000_0000;Potential Revolutionary Forces in Central Europe;8/714;English
cho_meet_1941_0715_000_0000;India in the War;8/715;English
cho_meet_1941_0716_000_0000;Population Problems in Relation to European Reconstruction;8/716;English
cho_meet_1941_0717_000_0000;African Tribal Opinion about the War;8/717;English
cho_meet_1941_0718_000_0000;Christianity and World Order;8/718;English
cho_meet_1941_0719_000_0000;The Eastern Mediterranean War Zone: Combatants and Onlookers;8/719;English
cho_meet_1941_0720_000_0000;The Present Position of Newfoundland;8/720;English
cho_meet_1941_0721_000_0000;Recent Events in Indo-China and Thailand and their Significance;8/721;English
cho_meet_1941_0722_000_0000;Le Congo Belge (In French);8/722;French
cho_meet_1941_0723_000_0000;World Shipping Problems;8/723;English
cho_meet_1941_0724_000_0000;The Reality of the Law of Nations;8/724;English
cho_meet_1941_0725_000_0000;Mexico and her Rôle Today;8/725;English
cho_meet_1941_0726_000_0000;South Africa's Native Problem;8/726;English
cho_meet_1941_0727_000_0000;The Present Situation in Iraq;8/727;English
cho_meet_1941_0728_000_0000;Spain: The Policy and Position of the Spanish Government;8/728;English
cho_meet_1941_0729_000_0000;Modern War;8/729;English
cho_meet_1941_0730_000_0000;Iceland and its Position Today;8/730;English
cho_meet_1941_0731_000_0000;The Problem of South America;8/731;English
cho_meet_1941_0732_000_0000;The United States and the War. I;8/732;English
cho_meet_1941_0733_000_0000;The Islands of the Pacific and their International Importance;8/733;English
cho_meet_1941_0734_000_0000;A First Approach to Post-War Europe;8/734;English
cho_meet_1941_0735_000_0000;The Choice before Poland;8/735;English
cho_meet_1941_0736_000_0000;Our Relations with Italy: Past and Future;8/736;English
cho_meet_1941_0737_000_0000;America and the War;8/737;English
cho_meet_1941_0738_000_0000;The Present Position of Finland;8/738;English
cho_meet_1941_0739_000_0000;The United States and the War. III American Co-Operation in the War and after it;8/739;English
cho_meet_1941_0740_000_0000;India's Experiment in Democracy;8/740;English
cho_meet_1941_0741_000_0000;Naval Strategy;8/741;English
cho_meet_1941_0742_000_0000;Malaya: Where Three Empires Meet;8/742;English
cho_meet_1941_0743_000_0000;Adolf Hitler before 1933;8/743;English
cho_meet_1941_0744_000_0000;Russia and the War;8/744;English
cho_meet_1941_0746_000_0000;The Place of Australian Agriculture in the Post-War World;8/746;English
cho_meet_1941_0747_000_0000;Occupied Territories I: France after the Armistice;8/747;English
cho_meet_1941_0748_000_0000;The Battle of the Pacific;8/748;English
cho_meet_1941_0749_000_0000;Occupied Territories II: The Background of the Situation in Yugoslavia;8/749;English
cho_meet_1941_0750_000_0000;Malta;8/750;English
cho_meet_1941_0751_000_0000;Burma Today;8/751;English
cho_meet_1941_0752_000_0000;The Conservation of World Natural Resources;8/752;English
cho_meet_1941_0753_000_0000;The Soviets in World Affairs;8/753;English
cho_meet_1941_0754_000_0000;Occupied Territories III. The Roumanian Tragedy;8/754;English
cho_meet_1941_0755_000_0000;The Re-Shaping of Europe, with Special Reference to Austria;8/755;English
cho_meet_1941_0756_000_0000;The Nazi Propaganda Machine;8/756;English
cho_meet_1941_0757_000_0000;Britain and Japan in the Far East;8/757;English
cho_meet_1941_0758_000_0000;The Eastern Frontier of Finland and the East Carelian Situation;8/758;English
cho_meet_1941_0759_000_0000;The Present Significance of Thailand;8/759;English
cho_meet_1941_0760_000_0000;The Effect of the War on the Minority Situation in Europe;8/760;English
cho_meet_1941_0761_000_0000;China and the World Situation;8/761;English
cho_meet_1941_0762_000_0000;Occupied Territories IV. Greece;8/762;English
cho_meet_1941_0763_000_0000;French Public Opinion at the Present Time (In French);8/763;French
cho_meet_1941_0764_000_0000;Winter Prospects in the Middle-East;8/764;English
cho_meet_1941_0765_000_0000;Morocco in the Present Struggle;8/765;English
cho_meet_1941_0766_000_0000;Occupied Territories V. Czecho-Slovakia's Present Struggle;8/766;English
cho_meet_1941_0767_000_0000;The Racial Problem in the Post-War World;8/767;English
cho_meet_1941_0768_000_0000;The Position of the Jews in Europe and their Future;8/768;English
cho_meet_1941_0769_000_0000;North Atlantic Relations;8/769;English
cho_meet_1941_0770_000_0000;What is Keeping America out of the War?;8/770;English
cho_meet_1941_0771_000_0000;Some Economic Lessons of the Inter-War Period;8/771;English
cho_meet_1941_0772_000_0000;The Technique of German Occupation;8/772;English
cho_meet_1941_0773_000_0000;A Witness Account of Prisoner-Of-War Camps in Germany and in Russia;8/773;English
cho_meet_1941_0774_000_0000;The Free Dutch Overseas;8/774;English
cho_meet_1941_0775_000_0000;The Place of Religion in the Present Struggle;8/775;English
cho_meet_1941_0776_000_0000;Reconstruction in China during and after the War;8/776;English
cho_meet_1941_0777_000_0000;The Greek Struggle: Economic Interests and Moral Factors;8/777;English
cho_meet_1941_0778_000_0000;South Africa: Its Political Problems and External Relations;8/778;English
cho_meet_1941_0779_000_0000;The Soviet Union's Total War;8/779;English
cho_meet_1941_0780_000_0000;Telecommunications and the Future;8/780;English
cho_meet_1941_0781_000_0000;Great Britain and China;8/781;English
cho_meet_1941_0782_000_0000;From 1921 to 1941 in Eire;8/782;English
cho_meet_1941_0783_000_0000;A View of World Affairs by an American Observer;8/783;English
cho_meet_1942_0785_000_0000;What Kind of Post-War Europe are we Fighting for?;8/785;English
cho_meet_1942_0786_000_0000;The Inner Asian Frontiers of China;8/786;English
cho_meet_1942_0787_000_0000;America Enters the War;8/787;English
cho_meet_1942_0788_000_0000;Australia's Political Problems and External Relations;8/788;English
cho_meet_1942_0789_000_0000;Japan's Economic Resources and the Present War;8/789;English
cho_meet_1942_0790_000_0000;Political and Economic Planning in Central Europe;8/790;English
cho_meet_1942_0791_000_0000;The Poles and Russia;8/791;English
cho_meet_1942_0792_000_0000;Education for Post-War Responsibilities;8/792;English
cho_meet_1942_0793_000_0000;Labour and Post-War Resettlement;8/793;English
cho_meet_1942_0794_000_0000;Science and International Politics;8/794;English
cho_meet_1942_0795_000_0000;The River Plate: Economic and Cultural Background with Special Reference to the Value of Cultural Relations;8/795;English
cho_meet_1942_0796_000_0000;German Exploitation of the Occupied Countries;8/796;English
cho_meet_1942_0797_000_0000;International Problems of the Future;8/797;English
cho_meet_1942_0798_000_0000;Uruguay's Stand against the Nazi Menace 1939-40;8/798;English
cho_meet_1942_0799_000_0000;The Position of Luxembourg;8/799;English
cho_meet_1942_0800_000_0000;India and the War;8/800;English
cho_meet_1942_0801_000_0000;Post-War Control of Germany;8/801;English
cho_meet_1942_0802_000_0000;War and Post-War Problems in Canada;8/802;English
cho_meet_1942_0803_000_0000;The Political Economy of the Tropical Far East: A General Survey of Social and Economic Conditions in South-East Asia;8/803;English
cho_meet_1942_0804_000_0000;The Post-War Planning of a Durable Peace: The First Step;8/804;English
cho_meet_1942_0805_000_0000;The Relations between Australia, New-Zealand and the United States;8/805;English
cho_meet_1942_0806_000_0000;The International Status of Free France;8/806;English
cho_meet_1942_0807_000_0000;West Africa and the War;8/807;English
cho_meet_1942_0808_000_0000;Immediate Post-War Relief;8/808;English
cho_meet_1942_0809_000_0000;Agriculture in Soviet Russia and Post-War Needs;8/809;English
cho_meet_1942_0810_000_0000;Present Plans Concerning Some Post-War Economic Problems;8/810;English
cho_meet_1942_0811_000_0000;None So Blind;8/811;English
cho_meet_1942_0812_000_0000;Switzerland Today;8/812;English
cho_meet_1942_0813_000_0000;L'Eveil De La Résistance En France;8/813;French
cho_meet_1942_0814_000_0000;Change and Continuity in Iran;8/814;English
cho_meet_1942_0815_000_0000;The United States, Russia and Ourselves;8/815;English
cho_meet_1942_0816_000_0000;Canada and the American Age;8/816;English
cho_meet_1942_0817_000_0000;India and China Compared and Contrasted;8/817;English
cho_meet_1942_0818_000_0000;On Yugoslavia;8/818;English
cho_meet_1942_0819_000_0000;Dix-Huit Mois D'Occupation a Paris;8/819;French
cho_meet_1942_0820_000_0000;India after the Cripps Mission;8/820;English
cho_meet_1942_0821_000_0000;Racial Fallacies and Realities in Europe;8/821;English
cho_meet_1942_0822_000_0000;French Experiments in Constitutional Government;8/822;English
cho_meet_1942_0823_000_0000;British Colonial Administration: Its Problems and its Future;8/823;English
cho_meet_1942_0824_000_0000;The Sino-Japanese War Situation in the Past Four and a Half Years;8/824;English
cho_meet_1942_0825_000_0000;Greece's Contribution to the Allied Cause;8/825;English
cho_meet_1942_0826_000_0000;Four Weeks in Neutral Sweden;8/826;English
cho_meet_1942_0827_000_0000;Modern Warfare;8/827;English
cho_meet_1942_0828_000_0000;Balance of Power: International Democracy or International Justice?;8/828;English
cho_meet_1942_0829_000_0000;Neutral Sweden;8/829;English
cho_meet_1942_0830_000_0000;The War-Time and Reconstruction Work of the International Labour Organization;8/830;English
cho_meet_1942_0831_000_0000;The Netherlands-Indies and Japan in the East Asiatic Conflict;8/831;English
cho_meet_1942_0833_000_0000;Denmark Today;8/833;English
cho_meet_1942_0835_000_0000;Some International Problems of Reconstruction;8/835;English
cho_meet_1942_0836_000_0000;Norway at War;8/836;English
cho_meet_1942_0837_000_0000;La France De Demain (In French);8/837;French
cho_meet_1942_0838_000_0000;Christian Co-Operation and the Future;8/838;English
cho_meet_1942_0839_000_0000;The Strategy of the War at Sea;8/839;English
cho_meet_1942_0840_000_0000;The Movements of Population and the Post-War Refugee Problem;8/840;English
cho_meet_1942_0841_000_0000;The Position in the Middle East;8/841;English
cho_meet_1942_0842_000_0000;The Aleutian Islands: Stepping Stones from Alaska to Asia;8/842;English
cho_meet_1942_0844_000_0000;The Outlook for World Finance;8/844;English
cho_meet_1942_0845_000_0000;Mexico's Contribution to Human Dignity in International Life;8/845;English
cho_meet_1942_0846_000_0000;Iceland;8/846;English
cho_meet_1942_0847_000_0000;Recollections of My Travels during Wartime (Russia and Turkestan) Sep 1939-April 1942;8/847;English
cho_meet_1942_0849_000_0000;Britain and America: What Price Partnership?;8/849;English
cho_meet_1942_0850_000_0000;India after Cripps;8/850;English
cho_meet_1942_0851_000_0000;The U.S.S.R. and Post -War Problems;8/851;English
cho_meet_1942_0852_000_0000;Last Days in Malaya;8/852;English
cho_meet_1942_0853_000_0000;Malta in Wartime;8/853;English
cho_meet_1942_0854_000_0000;China's Position as an Ally;8/854;English
cho_meet_1942_0855_000_0000;Great Britain and France in the Post-War World;8/855;English
cho_meet_1942_0856_000_0000;The Projection of Britain;8/856;English
cho_meet_1942_0857_000_0000;The Possibilities of International Co-Operation in Colonial Policy;8/857;English
cho_meet_1942_0858_000_0000;The South-West Pacific;8/858;English
cho_meet_1942_0859_000_0000;A War Correspondent at the Front;8/859;English
cho_meet_1942_0860_000_0000;Arab Countries;8/860;English
cho_meet_1942_0861_000_0000;A Survey of Post-War Problems: From the Bohemian Forest to the Black Sea;8/861;English
cho_meet_1942_0862_000_0000;The Higher Direction of the War;8/862;English
cho_meet_1942_0863_000_0000;Siam, Land of the Thai;8/863;English
cho_meet_1942_0864_000_0000;The Part Played by Propaganda in Modern Warfare;8/864;English
cho_meet_1942_0865_000_0000;Current Trends in the United States;8/865;English
cho_meet_1942_0866_000_0000;Observations Drawn from Some Years in Germany and Sweden;8/866;English
cho_meet_1942_0867_000_0000;Arctic Warfare;8/867;English
cho_meet_1942_0868_000_0000;Les Francais Combattants Devant La France;8/868;French
cho_meet_1942_0869_000_0000;Polish-Russian Relations;8/869;English
cho_meet_1942_0870_000_0000;Substitute Materials in War and in Peace;8/870;English
cho_meet_1942_0871_000_0000;The Working of the New Constitution in India,1937-1941;8/871;English
cho_meet_1942_0872_000_0000;The Development of the Peasant Movement in Poland;8/872;English
cho_meet_1942_0873_000_0000;Criticisms of British Far Eastern Policy;8/873;English
cho_meet_1942_0874_000_0000;India: The Present Position;8/874;English
cho_meet_1942_0875_000_0000;The Japanese Occupation of Shanghai: Some Personal Experiences;8/875;English
cho_meet_1942_0876_000_0000;La France Devant Les Francais Combattants;8/876;French
cho_meet_1942_0877_000_0000;The British Pacific Islands and the War;8/877;English
cho_meet_1942_0878_000_0000;The Belgian Congo;8/878;English
cho_meet_1942_0879_000_0000;The Modern Conception of Sea Power;8/879;English
cho_meet_1942_0880_000_0000;Italy in Post-War Europe;8/880;English
cho_meet_1942_0881_000_0000;The Present Position of British Prisoners of War;8/881;English
cho_meet_1942_0882_000_0000;Impressions of America- 23rd August to 30th October, 1942;8/882;English
cho_meet_1942_0883_000_0000;The France that will Live;8/883;English
cho_meet_1942_0884_000_0000;The Albanian Question Today;8/884;English
cho_meet_1942_0885_000_0000;La France Et Les Problemes Economiques D'Apres Guerre;8/885;French
cho_meet_1942_0886_000_0000;The Political Situation in India;8/886;English
cho_meet_1942_0888_000_0000;The Deterioration of Health on the Continent from Epidemics and Food Shortage;8/888;English
cho_meet_1942_0889_000_0000;Switzerland in War-Time;8/889;English
cho_meet_1942_0950_000_0000;Confidential Private Discussion Meeting;8/950;English
cho_meet_1942_0985_000_0000;Air Transport and the Future;8/985;English
cho_meet_1943_0898_000_0000;South America in Relation to the British Empire and the U. S. A.;8/898;English
cho_meet_1943_0899_000_0000;Private Discussion Meeting on Afghanistan;8/899;English
cho_meet_1943_0900_000_0000;The Austrian Labour Movement;8/900;English
cho_meet_1943_0901_000_0000;Life in Occupied France;8/901;English
cho_meet_1943_0902_000_0000;Relief Work after the War;8/902;English
cho_meet_1943_0903_000_0000;Science in Soviet Russia;8/903;English
cho_meet_1943_0904_000_0000;Manchuria Today;8/904;English
cho_meet_1943_0905_000_0000;Aiming at the Year 2000;8/905;English
cho_meet_1943_0906_000_0000;Situation in Unoccupied France;8/906;English
cho_meet_1943_0910_000_0000;The Christian Answer to Racial Oppression in Europe Today;8/910;English
cho_meet_1943_0911_000_0000;The Trial of War Criminals;8/911;English
cho_meet_1943_0912_000_0000;Student Life and Opinion in the U.S.A. and Canada;8/912;English
cho_meet_1943_0913_000_0000;The London International Assembly;8/913;English
cho_meet_1943_0914_000_0000;Responsibilities of World Leadership from the Point of View of Greece as a Mediterranean Power;8/914;English
cho_meet_1943_0915_000_0000;The Dutch West Indies in Peace and War;8/915;English
cho_meet_1943_0916_000_0000;The Background of the Present Position in Morocco;8/916;English
cho_meet_1943_0917_000_0000;The German Propaganda Machine under Strain;8/917;English
cho_meet_1943_0918_000_0000;American Criticisms of Britain;8/918;English
cho_meet_1943_0919_000_0000;What to do with Germany;8/919;English
cho_meet_1943_0920_000_0000;American Ideas of Post-War Settlement;8/920;English
cho_meet_1943_0921_000_0000;Some Aspects of Post-War Re-Location;8/921;English
cho_meet_1943_0922_000_0000;Impressions of Spain and Portugal, Christmas 1942;8/922;English
cho_meet_1943_0924_000_0000;Finance and Reconstruction;8/924;English
cho_meet_1943_0925_000_0000;Problems of the Pacific: I. The Colonial Problem;8/925;English
cho_meet_1943_0926_000_0000;An Account of the Visit of the British Parliamentary Mission to China;8/926;English
cho_meet_1943_0927_000_0000;The Present Resistance in Holland and the Preparation for the Future as Reflected in the Dutch Underground Press;8/927;English
cho_meet_1943_0928_000_0000;La France D'Aujourd'Hui;8/928;French
cho_meet_1943_0929_000_0000;Norway under German Occupation;8/929;English
cho_meet_1943_0930_000_0000;Private Meeting;8/930;English
cho_meet_1943_0931_000_0000;Ireland in Wartime;8/931;English
cho_meet_1943_0932_000_0000;Problems of the Pacific: II. India;8/932;English
cho_meet_1943_0933_000_0000;Brazil Today;8/933;English
cho_meet_1943_0934_000_0000;Future International Trade as it Might be According to World Trade Alliance Principles;8/934;English
cho_meet_1943_0935_000_0000;Japan as Aggressor;8/935;English
cho_meet_1943_0936_000_0000;Labour in America;8/936;English
cho_meet_1943_0937_000_0000;What to do with Germany?;8/937;English
cho_meet_1943_0938_000_0000;Problems of the Pacific: III. Malaya and South-East Asia;8/938;English
cho_meet_1943_0939_000_0000;The Australian Home Front;8/939;English
cho_meet_1943_0940_000_0000;The Women's Movement in France;8/940;English
cho_meet_1943_0941_000_0000;International Comparisons with the Beveridge Report;8/941;English
cho_meet_1943_0942_000_0000;Impressions of a Recent Visit to America;8/942;English
cho_meet_1943_0943_000_0000;Egypt and the War;8/943;English
cho_meet_1943_0944_000_0000;Les Masses Populaires De France Et Les Problémes D'Aujourd'Hui Et De Demain;8/944;French
cho_meet_1943_0945_000_0000;The International Currency Plans;8/945;English
cho_meet_1943_0946_000_0000;An American Christian View of the Future of World Order;8/946;English
cho_meet_1943_0947_000_0000;Some Observations on a Post-War Settlement in South-East Asia, with Special Reference to Siam;8/947;English
cho_meet_1943_0948_000_0000;L'Opinion Francaise a L'Egard De Vichy Et Des Allies;8/948;French
cho_meet_1943_0949_000_0000;The Future of World Agriculture;8/949;English
cho_meet_1943_0951_000_0000;The Middle East and Turkey: The British Council's Work;8/951;English
cho_meet_1943_0952_000_0000;The Outlook for Italy;8/952;English
cho_meet_1943_0953_000_0000;Polish-Russian Relations;8/953;English
cho_meet_1943_0954_000_0000;Opinion in the United States on Post-War Problems;8/954;English
cho_meet_1943_0955_000_0000;An International Bill for the Rights of Man;8/955;English
cho_meet_1943_0956_000_0000;British Commonwealth Relations;8/956;English
cho_meet_1943_0957_000_0000;Norway's Problems of Social and Economic Reconstruction;8/957;English
cho_meet_1943_0958_000_0000;The United Nations Conference on Food and Agriculture, Hot Springs, VA;8/958;English
cho_meet_1943_0959_000_0000;From Lisbon to Teheran;8/959;English
cho_meet_1943_0960_000_0000;The Present Situation in South Africa;8/960;English
cho_meet_1943_0961_000_0000;The Problem of Germany;8/961;English
cho_meet_1943_0962_000_0000;The Commonwealth's Place in the World Economic Structure;8/962;English
cho_meet_1943_0963_000_0000;The Problem of Italy;8/963;English
cho_meet_1943_0964_000_0000;The Problem of Japan;8/964;English
cho_meet_1943_0965_000_0000;Current Affairs in America with Particular Reference to Educational Problems;8/965;English
cho_meet_1943_0966_000_0000;Post-War Reconstruction as Reflected in the Underground Press of Norway;8/966;English
cho_meet_1943_0967_000_0000;Obstacles to Anglo-American Co-Operation;8/967;English
cho_meet_1943_0968_000_0000;Food as a Basis for International Co-Operation;8/968;English
cho_meet_1943_0969_000_0000;Portugal Today;8/969;English
cho_meet_1943_0971_000_0000;The Future of Colonial Territories in Africa;8/971;English
cho_meet_1943_0972_000_0000;Air Problems in the Commonwealth;8/972;English
cho_meet_1943_0973_000_0000;American University Opinion on Post-War Problems;8/973;English
cho_meet_1943_0974_000_0000;The Position in Greece;8/974;English
cho_meet_1943_0976_000_0000;Impressions of a Brief Visit to Russia;8/976;English
cho_meet_1943_0977_000_0000;L'afrique Francaise;8/977;French
cho_meet_1943_0978_000_0000;The Place of the Far East in World Reconstruction;8/978;English
cho_meet_1943_0979_000_0000;The Situation in Newfoundland;8/979;English
cho_meet_1943_0980_000_0000;Mediterranean Tour, September 1943, with Special Reference to Relations with the Arab and African Worlds;8/980;English
cho_meet_1943_0981_000_0000;Yugoslavia;8/981;English
cho_meet_1943_0982_000_0000;Future Developments in West Africa;8/982;English
cho_meet_1943_0983_000_0000;Possibilities of a Constitutional Settlement in India;8/983;English
cho_meet_1943_0986_000_0000;Aviation Group: The Future of Aviation;8/986;English
cho_meet_1943_0987_000_0000;Aviation Group: British Air Policy in the Pacific;8/987;English
