cho_meet_1765_3029_000_0000;Impressions of the Commonwealth Prime Minister's Conference;8/3029;English
cho_meet_1920_0001_000_0000;Diplomacy by Conference;8/1;English
cho_meet_1920_0002_000_0000;Russia;8/2;English
cho_meet_1921_0003_000_0000;Greece;8/3;English
cho_meet_1921_0004_000_0000;Disarmament;8/4;English
cho_meet_1921_0005_000_0000;Upper Silesia;8/5;English
cho_meet_1921_0006_000_0000;Self-Determination of Nationalities;8/6;English
cho_meet_1922_0007_000_0000;Zionism;8/7;English
cho_meet_1922_0008_000_0000;Austria;8/8;English
cho_meet_1922_0009_000_0000;The Egyptian Question;8/9;English
cho_meet_1922_0010_000_0000;Washington Conference;8/10;English
cho_meet_1922_0011_000_0000;The Influence of Communications on the Regulation of International Affairs;8/11;English
cho_meet_1923_0012_000_0000;The Balance of Power;8/12;English
cho_meet_1923_0013_000_0000;The Position of France;8/13;English
cho_meet_1923_0014_000_0000;Poland and the Problem of National Minorities;8/14;English
cho_meet_1923_0015_000_0000;Tangier and Internationalisation;8/15;English
cho_meet_1924_0016_000_0000;The Problem of Poland;8/16;English
cho_meet_1924_0017_000_0000;Fiscal Policy and International Relations;8/17;English
cho_meet_1924_0018_000_0000;The Draft Treats of Mutual Assistance;8/18;English
cho_meet_1924_0019_000_0000;Claims of British Subjects in Turkey;8/19;English
cho_meet_1924_0020_000_0000;La Belgique Et La Politique Europeene Depuis La Guerre;8/20;English
cho_meet_1924_0021_000_0000;Flag Discrimination;8/21;English
cho_meet_1924_0022_000_0000;The Political Situation in Iraq;8/22;English
cho_meet_1925_0023_000_0000;Wahabism British Interests;8/23;English
cho_meet_1925_0024_000_0000;The Mind of China;8/24;English
cho_meet_1925_0025_000_0000;British Foreign Policy in Asia and its Relation to India;8/25;English
cho_meet_1925_0026_000_0000;The Problem of the Rhineland;8/26;English
cho_meet_1925_0027_000_0000;A Practical Programme for Reconstruction in China: The Use of Force;8/27;English
cho_meet_1925_0029_000_0000;The Future of Egypt;8/29;English
cho_meet_1925_0030_000_0000;The Practical Working of the Mandates System;8/30;English
cho_meet_1925_0031_000_0000;The Judicial Settlement of International Disputes;8/31;English
cho_meet_1925_0032_000_0000;Britain and China;8/32;English
cho_meet_1925_0033_000_0000;Trade Treaties and Capitulations in Morocco;8/33;English
cho_meet_1925_0034_000_0000;The World Status of the Latin American Republics;8/34;English
cho_meet_1926_0035_000_0000;The Doctrine of Fascism;8/35;English
cho_meet_1926_0036_000_0000;Mineral Resources in Certain International Relations;8/36;English
cho_meet_1926_0037_000_0000;The Secret of High Wages;8/37;English
cho_meet_1926_0038_000_0000;Reconstruction in China;8/38;English
cho_meet_1926_0039_000_0000;The Seventh Assembly of the League of Nations;8/39;English
cho_meet_1926_0040_000_0000;The Renaissance in China;8/40;English
cho_meet_1926_0041_000_0000;The Irish Free State and the British Empire;8/41;English
cho_meet_1926_0042_000_0000;The Imperial Conference;8/42;English
cho_meet_1926_2842_000_0000;La Republique Cote D'ivoire;8/2842;English
cho_meet_1927_0043_000_0000;Anglo-Russian Relations;8/43;English
cho_meet_1927_0043_000_0000;Anglo-Russian Relations;8/43;English
cho_meet_1927_0044_000_0000;The Humanitarian Activities of the League of Nations;8/44;English
cho_meet_1927_0045_000_0000;The Prospects of Democracy;8/45;English
cho_meet_1927_0046_000_0000;The Psychology of French Political Parties;8/46;English
cho_meet_1928_0047_000_0000;Disarmament;8/47;English
cho_meet_1928_0048_000_0000;The Present Situation in the Balkans;8/48;English
cho_meet_1928_0049_000_0000;The Administration of the Mandate in Western Samoa;8/49;English
cho_meet_1928_0050_000_0000;The Present Economic Position in Mexico;8/50;English
cho_meet_1928_0051_000_0000;Arabia and the Arabs;8/51;English
cho_meet_1929_0052_000_0000;Latin America and the League of Nations;8/52;English
cho_meet_1929_0053_000_0000;The Franco-German Rapprochement and its Importance for Europe;8/53;English
cho_meet_1929_0054_000_0000;The Freedom of the Seas;8/54;English
cho_meet_1929_0054_000_0000;The Freedom of the Seas;8/54;English
cho_meet_1929_0055_000_0000;La Politique De La Belgique Au Congo;8/55;French
cho_meet_1929_0056_000_0000;Schools for International Politicians;8/56;English
cho_meet_1929_0058_000_0000;International Aspects of the Coal Problem;8/58;English
cho_meet_1929_0059_000_0000;German Political Problems;8/59;English
cho_meet_1929_0060_000_0000;Some Problems in India;8/60;English
cho_meet_1929_0061_000_0000;Central African Mandates and the New Colonial Policy;8/61;English
cho_meet_1929_0062_000_0000;Economic and Financial Relations Between the U. S. A. and Europe;8/62;English
cho_meet_1929_0063_000_0000;Anglo-French Relations;8/63;English
cho_meet_1930_0064_000_0000;Some Aspects of the Naval Conference;8/64;English
cho_meet_1930_0065_000_0000;The Post-War Student in Europe;8/65;English
cho_meet_1930_0066_000_0000;Spain: Yesterday, Today and Tomorrow;8/66;English
cho_meet_1930_0067_000_0000;The Hague Conference and Non-German Reparations;8/67;English
cho_meet_1930_0068_000_0000;The Conference of the Institute of Pacific Relations at Kyoto;8/68;English
cho_meet_1930_0069_000_0000;Publicity and Public Opinion in Russia;8/69;English
cho_meet_1930_0070_000_0000;The Present Position and Future Prospects of Education in India;8/70;English
cho_meet_1930_0071_000_0000;Political Progress in Czechoslovakia;8/71;English
cho_meet_1930_0072_000_0000;Personal Impressions of a Journey from Vladivostok to Moscow;8/72;English
cho_meet_1930_0073_000_0000;The Present Situation in Mexico;8/73;English
cho_meet_1930_0074_000_0000;The Economic Situation in the Belgian Congo;8/74;English
cho_meet_1930_0075_000_0000;Relations Between Banking and Industry in Post-War Germany;8/75;English
cho_meet_1930_0076_000_0000;Commercial Conditions in China;8/76;English
cho_meet_1930_0077_000_0000;The Situation in the Balkans;8/77;English
cho_meet_1930_0077_000_0000;The Situation in the Balkans;8/77;English
cho_meet_1930_0078_000_0000;Some Consequences of American Influence in Europe, 1919-30;8/78;English
cho_meet_1930_0079_000_0000;France and the League of Nations;8/79;English
cho_meet_1930_0080_000_0000;International Efforts for the Protection of Health;8/80;English
cho_meet_1930_0081_000_0000;The Present Position of the Russian Church;8/81;English
cho_meet_1930_0082_000_0000;Covenant Obligations;8/82;English
cho_meet_1930_0083_000_0000;Germany and Eastern European Politics;8/83;English
cho_meet_1930_0084_000_0000;Slavery;8/84;English
cho_meet_1930_0085_000_0000;European Minorities;8/85;English
cho_meet_1930_0086_000_0000;National Economic Policy in Germany Since the Stabilisation;8/86;English
cho_meet_1930_0087_000_0000;The Institute of Pacific Relations;8/87;English
cho_meet_1930_0088_000_0000;The Political Position in China;8/88;English
cho_meet_1930_0089_000_0000;The Present Situation in Upper Silesia;8/89;English
cho_meet_1930_0090_000_0000;The Present Position in Rumania;8/90;English
cho_meet_1930_0091_000_0000;The Press as a Factor in International Affairs;8/91;English
cho_meet_1930_0092_000_0000;The Economic and Political Development of Tanganyika;8/92;English
cho_meet_1930_0093_000_0000;Financial Reconstruction for China;8/93;English
cho_meet_1930_0094_000_0000;Geography and World Trade;8/94;English
cho_meet_1930_0095_000_0000;Egypt;8/95;English
cho_meet_1930_0096_000_0000;The Political Relations Between Great Britain and Egypt;8/96;English
cho_meet_1930_0097_000_0000;Some Problems of the European Border States of Soviet Russia;8/97;English
cho_meet_1930_0098_000_0000;International Aspects of Colonial Administration;8/98;English
cho_meet_1930_0099_000_0000;Some Aspects of the World Economic Situation;8/99;English
cho_meet_1930_0100_000_0000;An International Language;8/100;English
cho_meet_1930_0101_000_0000;International Aspects of the White Australia Policy;8/101;English
cho_meet_1930_0102_000_0000;The International Aspects of the Cinema;8/102;English
cho_meet_1930_0103_000_0000;Japanese Population Questions;8/103;English
cho_meet_1930_0104_000_0000;Dictatorships;8/104;English
cho_meet_1930_0105_000_0000;The International Narcotic Drugs Situation;8/105;English
cho_meet_1930_0106_000_0000;Impressions of the Russian Situation;8/106;English
cho_meet_1930_0107_000_0000;Modern Thought in China;8/107;English
cho_meet_1930_0108_000_0000;Italian Foreign Policy;8/108;English
cho_meet_1930_0109_000_0000;Art as a Factor in International Relations;8/109;English
cho_meet_1930_0110_000_0000;German - Polish Relations;8/110;English
cho_meet_1930_0111_000_0000;European and American Economic Depressions and Their Political Consequences;8/111;English
cho_meet_1930_0112_000_0000;The Agrarian Movement in Eastern and South-Eastern Europe;8/112;English
cho_meet_1930_0113_000_0000;The Convention of Financial Assistance;8/113;English
cho_meet_1930_0114_000_0000;Public Opinion on the League of Nations;8/114;English
cho_meet_1930_0115_000_0000;The Situation in Turkey;8/115;English
cho_meet_1930_0116_000_0000;Banking and Industry in France;8/116;English
cho_meet_1931_0117_000_0000;The Gold Problem;8/117;English
cho_meet_1931_0118_000_0000;The Student and Politics in Present Day Germany;8/118;English
cho_meet_1931_0119_000_0000;The Situation in Eastern Europe;8/119;English
cho_meet_1931_0120_000_0000;Political Relations in the Balkans;8/120;English
cho_meet_1931_0121_000_0000;Unemployment in the U. S. A.;8/121;English
cho_meet_1931_0122_000_0000;The British Press and International Affairs;8/122;English
cho_meet_1931_0123_000_0000;The European Outlook;8/123;English
cho_meet_1931_0124_000_0000;Germany and the League of Nations;8/124;English
cho_meet_1931_0125_000_0000;International Activities of the Red Cross Societies in Peace Time;8/125;English
cho_meet_1931_0126_000_0000;The Present Situation in China;8/126;English
cho_meet_1931_0127_000_0000;The United States and the International Situation;8/127;English
cho_meet_1931_0128_000_0000;A German View of the Future of Europe;8/128;English
cho_meet_1931_0129_000_0000;The Present Situation in Egypt;8/129;English
cho_meet_1931_0130_000_0000;International Aspects of Broadcasting;8/130;English
cho_meet_1931_0131_000_0000;The Private Manufacture of Arms, Ammunitions and Implements of War;8/131;English
cho_meet_1931_0132_000_0000;Italian Foreign Policy;8/132;English
cho_meet_1931_0133_000_0000;The Problem of Nationalities;8/133;English
cho_meet_1931_0134_000_0000;Population Movements in the Near East;8/134;English
cho_meet_1931_0135_000_0000;Economic Nationalism;8/135;English
cho_meet_1931_0136_000_0000;Conditions in Russian Timber Camps;8/136;English
cho_meet_1931_0137_000_0000;Historical Parallels to Current International Problems;8/137;English
cho_meet_1931_0138_000_0000;Reparations as a Factor in German Politics;8/138;English
cho_meet_1931_0139_000_0000;The Population Factor in International Relations;8/139;English
cho_meet_1931_0140_000_0000;The Austro-German Customs Union;8/140;English
cho_meet_1931_0141_000_0000;The International Wheat Situation;8/141;English
cho_meet_1931_0142_000_0000;International Aspects of Civil Aviation;8/142;English
cho_meet_1931_0143_000_0000;The Organisation of the League Secretariat;8/143;English
cho_meet_1931_0144_000_0000;Franco - Italian Naval Relations;8/144;English
cho_meet_1931_0145_000_0000;China Yesterday and Today;8/145;English
cho_meet_1931_0146_000_0000;Modern Geography and the Study of International Relations;8/146;English
cho_meet_1931_0147_000_0000;Slavery;8/147;English
cho_meet_1931_0148_000_0000;The Pan-European Outlook;8/148;English
cho_meet_1931_0149_000_0000;The New Groupings in Europe;8/149;English
cho_meet_1931_0150_000_0000;French Foreign Policy and the European Union;8/150;English
cho_meet_1931_0151_000_0000;The Present Position in Danzig;8/151;English
cho_meet_1931_0152_000_0000;Germany and Italy During the Chequers Conversations;8/152;English
cho_meet_1931_0153_000_0000;The Challenge of the Russian Five-Year Plan;8/153;English
cho_meet_1931_0154_000_0000;The South African Native Question and the Future of the Union;8/154;English
cho_meet_1931_0155_000_0000;The Present Position in Tanganyika;8/155;English
cho_meet_1931_0156_000_0000;The Problem of Disarmament in the Light of History;8/156;English
cho_meet_1931_0157_000_0000;The New China;8/157;English
cho_meet_1931_0158_000_0000;Second Annual Dinner;8/158;English
cho_meet_1931_0159_000_0000;The Situation in Turkey;8/159;English
cho_meet_1931_0160_000_0000;The International Economic Crisis;8/160;English
cho_meet_1931_0161_000_0000;The Situation in Hungary;8/161;English
cho_meet_1931_0162_000_0000;The Twelfth Assembly;8/162;English
cho_meet_1931_0163_000_0000;An International Police Force?;8/163;English
cho_meet_1931_0164_000_0000;The Disputed Sovereignty Over East Greenland;8/164;English
cho_meet_1931_0165_000_0000;The Problem of the Indian Minorities;8/165;English
cho_meet_1931_0166_000_0000;The Economic Possibilities of Iraq;8/166;English
cho_meet_1931_0167_000_0000;The Problem of Cyprus;8/167;English
cho_meet_1931_0168_000_0000;The German View of Disarmament;8/168;English
cho_meet_1931_0169_000_0000;The Balance of Trade;8/169;English
cho_meet_1931_0170_000_0000;Social Effects of the Economic Crisis in the Succession States;8/170;English
cho_meet_1931_0171_000_0000;The Worker's Life in Russia;8/171;English
cho_meet_1931_0172_000_0000;The Future of the Pound;8/172;English
cho_meet_1931_0173_000_0000;The Situation in the Irish Free State;8/173;English
cho_meet_1931_0174_000_0000;Italy and the Vatican;8/174;English
cho_meet_1931_0175_000_0000;Eldorado: An Experiment of International Forest Colonization;8/175;English
cho_meet_1931_0176_000_0000;The Polish View of Disarmament;8/176;English
cho_meet_1932_0177_000_0000;A Stabilized Empire Currency;8/177;English
cho_meet_1932_0178_000_0000;Reparations;8/178;English
cho_meet_1932_0179_000_0000;The Czechoslovak View of Disarmament;8/179;English
cho_meet_1932_0180_000_0000;The Fourth Conference of the I. P. R.;8/180;English
cho_meet_1932_0181_000_0000;Judicial Reform and the Egyptian Settlement;8/181;English
cho_meet_1932_0182_000_0000;Constitutional Tendencies in Eastern Countries;8/182;English
cho_meet_1932_0183_000_0000;The Crisis in the Far East;8/183;English
cho_meet_1932_0184_000_0000;States and Their Shipping Policies;8/184;English
cho_meet_1932_0185_000_0000;Germany, Poland, Czechoslovakia and the Disarmament Problem;8/185;English
cho_meet_1932_0186_000_0000;The Political Situation in Germany;8/186;English
cho_meet_1932_0187_000_0000;The Economic Situation in the United States;8/187;English
cho_meet_1932_0188_000_0000;Agriculture: The Real Problem in India;8/188;English
cho_meet_1932_0189_000_0000;French Financial Warfare;8/189;English
cho_meet_1932_0190_000_0000;European Dictatorships: Analogies and Differences;8/190;English
cho_meet_1932_0191_000_0000;Experiences of Soviet Rule in the Caucasus;8/191;English
cho_meet_1932_0192_000_0000;The Situation in Austria;8/192;English
cho_meet_1932_0193_000_0000;Australia - a Survey;8/193;English
cho_meet_1932_0194_000_0000;The Relinquishment of the Iraq Mandate;8/194;English
cho_meet_1932_0195_000_0000;Argentina and British Interests;8/195;English
cho_meet_1932_0196_000_0000;Prospects of a Danubian Federation;8/196;English
cho_meet_1932_0197_000_0000;Education Tendencies in Ceylon, Java and Indo-China;8/197;English
cho_meet_1932_0198_000_0000;Gold, Reparations and the Crisis;8/198;English
cho_meet_1932_0199_000_0000;The German View of the Danubian Plan;8/199;English
cho_meet_1932_0200_000_0000;The International Aspect of the Coal Problem;8/200;English
cho_meet_1932_0201_000_0000;The French Elections;8/201;English
cho_meet_1932_0202_000_0000;The Situation in Ireland;8/202;English
cho_meet_1932_0203_000_0000;Lessons of the Far Eastern Crisis;8/203;English
cho_meet_1932_0204_000_0000;Basic English as an International Language;8/204;English
cho_meet_1932_0205_000_0000;The Co-Operative Movement in the East;8/205;English
cho_meet_1932_0206_000_0000;A French View of the World Crisis;8/206;English
cho_meet_1932_0207_000_0000;Dangers of the Memel Dispute (Discussion Only);8/207;English
cho_meet_1932_0208_000_0000;The Asiatic Policy of Soviet Russia;8/208;English
cho_meet_1932_0209_000_0000;The Future of Nationalism;8/209;English
cho_meet_1932_0210_000_0000;The Campaign Against the Drug Traffic;8/210;English
cho_meet_1932_0211_000_0000;The Ordinances in India;8/211;English
cho_meet_1932_0212_000_0000;Franco-Italian Relations;8/212;English
cho_meet_1932_0213_000_0000;The Prospects of the Lausanne Conference;8/213;English
cho_meet_1932_0214_000_0000;The Disarmament Conference;8/214;English
cho_meet_1932_0215_000_0000;The Maltese Situation;8/215;English
cho_meet_1932_0216_000_0000;Danzig and the Polish Corridor;8/216;English
cho_meet_1932_0217_000_0000;The Crisis of the Intelligentsia in Central Europe;8/217;English
cho_meet_1932_0218_000_0000;The Ottawa Conference;8/218;English
cho_meet_1932_0219_000_0000;The Milan Conference of Institutions for the Scientific Study of International Relations;8/219;English
cho_meet_1932_0220_000_0000;Chile: Post-War Developments;8/220;English
cho_meet_1932_0221_000_0000;The Catholic Church in International Affairs;8/221;English
cho_meet_1932_0222_000_0000;Soviet Russia;8/222;English
cho_meet_1932_0223_000_0000;Chatham House Annual Dinner;8/223;English
cho_meet_1932_0224_000_0000;The Japanese Attitude to the Far Eastern Question;8/224;English
cho_meet_1932_0225_000_0000;Danzig and the Polish Corridor;8/225;English
cho_meet_1932_0226_000_0000;Ireland and the Policy of Mr De Valera;8/226;English
cho_meet_1932_0227_000_0000;Impressions of the State of China;8/227;English
cho_meet_1932_0228_000_0000;Mustafa Kemal and the Future of Turkey;8/228;English
cho_meet_1932_0229_000_0000;Pacifism: A Danger to World Peace?;8/229;English
cho_meet_1932_0230_000_0000;The XIIIth Assembly of the League of Nations;8/230;English
cho_meet_1932_0231_000_0000;Latin America: Some Social and Political Problems;8/231;English
cho_meet_1932_0232_000_0000;The Basis of Racial Conciliation in South Africa;8/232;English
cho_meet_1932_0233_000_0000;The Land Development Programme and the Emigration Policy of the Italian Government;8/233;English
cho_meet_1932_0234_000_0000;A Chinese View of the Far Eastern Question;8/234;English
cho_meet_1932_0235_000_0000;International Repercussions of the Ottawa Agreements;8/235;English
cho_meet_1932_0236_000_0000;The Third Indian Round Table Conference;8/236;English
cho_meet_1932_0237_000_0000;Great Britain and Egyptian Public Opinion;8/237;English
cho_meet_1932_0238_000_0000;The Political Situation in Ireland;8/238;English
cho_meet_1932_0239_000_0000;What is Happening in Russia?;8/239;English
cho_meet_1932_0240_000_0000;America and War Debts;8/240;English
cho_meet_1932_0241_000_0000;Increase in Productivity and Trade Depression;8/241;English
cho_meet_1932_0242_000_0000;Disarmament: The Present Phase;8/242;English
cho_meet_1932_0243_000_0000;The Re-Establishment of the Freedom of International Payments;8/243;English
cho_meet_1932_0244_000_0000;The Development of Institutions of Government in the U. S. S. R.;8/244;English
cho_meet_1932_0245_000_0000;Germany in the First Week in December (1932);8/245;English
cho_meet_1932_0246_000_0000;War Debts;8/246;English
cho_meet_1933_0247_000_0000;Sanctions;8/247;English
cho_meet_1933_0248_000_0000;The Psychology of the Middle West;8/248;English
cho_meet_1933_0249_000_0000;The Validity of Marxism Today;8/249;English
cho_meet_1933_0250_000_0000;"Ibn Sa'&#x00FB;d and the Future of Arabia";8/250;English
cho_meet_1933_0251_000_0000;American Public Opinion and War Debts;8/251;English
cho_meet_1933_0252_000_0000;The Situation in Bulgaria;8/252;English
cho_meet_1933_0253_000_0000;Ottawa and Empire Unity;8/253;English
cho_meet_1933_0254_000_0000;Austrian Economic Problems;8/254;English
cho_meet_1933_0255_000_0000;The Problem of International Goodwill;8/255;English
cho_meet_1933_0256_000_0000;Weaknesses in the Machinery of the League;8/256;English
cho_meet_1933_0257_000_0000;The Present Situation in the Far East;8/257;English
cho_meet_1933_0258_000_0000;European Impressions;8/258;English
cho_meet_1933_0259_000_0000;American Democracy and the New Problems;8/259;English
cho_meet_1933_0260_000_0000;The Economic Background of the Political Crisis in South Africa;8/260;English
cho_meet_1933_0261_000_0000;The League and the Sino-Japanese Conflict;8/261;English
cho_meet_1933_0262_000_0000;Nineteenth Century Parallels to the Present Economic Depression;8/262;English
cho_meet_1933_0263_000_0000;The League Covenant and the Sino-Japanese Conflict;8/263;English
cho_meet_1933_0264_000_0000;Social Conditions in the U. S. A.;8/264;English
cho_meet_1933_0265_000_0000;Shipping Subsidies as an International Problem;8/265;English
cho_meet_1933_0266_000_0000;The Foreign Policy of Fascist Italy;8/266;English
cho_meet_1933_0267_000_0000;Aerial Disarmament;8/267;English
cho_meet_1933_0268_000_0000;U.S.S.R. and Chinese Turkestan;8/268;English
cho_meet_1933_0269_000_0000;The Triangle of English, French and American Finance;8/269;English
cho_meet_1933_0270_000_0000;An Account of the Fighting between Chinese and Japanese Armies in Jehol during March 1933 (A Memorandum);8/270;English
cho_meet_1933_0271_000_0000;The Suez Canal;8/271;English
cho_meet_1933_0272_000_0000;Soviet Legal Methods;8/272;English
cho_meet_1933_0273_000_0000;Economic Recovery: A French View;8/273;English
cho_meet_1933_0274_000_0000;The German Attitude to Colonial Problems;8/274;English
cho_meet_1933_0275_000_0000;The Problem of Constitutional Reform in India;8/275;English
cho_meet_1933_0276_000_0000;The New American Administration;8/276;English
cho_meet_1933_0277_000_0000;A European Monetary Federation;8/277;English
cho_meet_1933_0278_000_0000;The Intellectual Background of the Spanish Revolution;8/278;English
cho_meet_1933_0279_000_0000;Impressions of Present German Conditions;8/279;English
cho_meet_1933_0280_000_0000;Austrian Developments: Economic and Political;8/280;English
cho_meet_1933_0281_000_0000;The Progress of China;8/281;English
cho_meet_1933_0282_000_0000;Imponderables in the Far East;8/282;English
cho_meet_1933_0283_000_0000;Indian Public Opinion on the White Paper;8/283;English
cho_meet_1933_0284_000_0000;Recent Events in Greece;8/284;English
cho_meet_1933_0285_000_0000;The Problem of Constitutional Reform in India;8/285;English
cho_meet_1933_0286_000_0000;The Present Regime in Germany;8/286;English
cho_meet_1933_0287_000_0000;The Problem of the Ukraine;8/287;English
cho_meet_1933_0288_000_0000;The Methods of Planning in the U. S. S. R.;8/288;English
cho_meet_1933_0289_000_0000;American Public Opinion on the World Economic Conference;8/289;English
cho_meet_1933_0290_000_0000;The League, Manchuria and the Pacifists;8/290;English
cho_meet_1933_0291_000_0000;Spain Under the Republic;8/291;English
cho_meet_1933_0292_000_0000;Austria and National Socialism;8/292;English
cho_meet_1933_0293_000_0000;The Cuban Troubles in the Light of International Law;8/293;English
cho_meet_1933_0294_000_0000;The Fifth Conference of the Institute of Pacific Relations;8/294;English
cho_meet_1933_0295_000_0000;Youth Movements;8/295;English
cho_meet_1933_0296_000_0000;Polish-Soviet Relations;8/296;English
cho_meet_1933_0297_000_0000;Observations of the Latest Internal and External Policy of the Hitler Government;8/297;English
cho_meet_1933_0298_000_0000;Communism in China;8/298;English
cho_meet_1933_0299_000_0000;The Significance of the Russian Communist Outlook;8/299;English
cho_meet_1933_0300_000_0000;The Transylvanian Problem;8/300;English
cho_meet_1933_0301_000_0000;Soviet Foreign Policy;8/301;English
cho_meet_1933_0302_000_0000;The International Consequences of Germany's Secession From the League;8/302;English
cho_meet_1933_0303_000_0000;Economic Planning and International Relations;8/303;English
cho_meet_1933_0304_000_0000;An American View of the Present Political Situation in Europe;8/304;English
cho_meet_1933_0305_000_0000;Some Basic Factors Behind Japanese Policy;8/305;English
cho_meet_1934_0306_000_0000;British Commonwealth Relations;8/306;English
cho_meet_1934_0307_000_0000;Impressions of the American State of Mind;8/307;English
cho_meet_1934_0308_000_0000;The German Labour Camp Movement;8/308;English
cho_meet_1934_0309_000_0000;The Constitutional Aspect of President Roosevelt's Recovery Programme;8/309;English
cho_meet_1934_0310_000_0000;Great Britain and the Economic Position of Denmark;8/310;English
cho_meet_1934_0311_000_0000;The Situation in Spain;8/311;English
cho_meet_1934_0312_000_0000;Is there an Empire Foreign Policy?;8/312;English
cho_meet_1934_0313_000_0000;Franco-Italian Relations;8/313;English
cho_meet_1934_0314_000_0000;Ireland and the British Commonwealth;8/314;English
cho_meet_1934_0315_000_0000;The Struggle in Austria;8/315;English
cho_meet_1934_0316_000_0000;Japanese Competition in World Markets;8/316;English
cho_meet_1934_0317_000_0000;Politics and Economics in Palestine;8/317;English
cho_meet_1934_0318_000_0000;The Age of Counter - Colonisation;8/318;English
cho_meet_1934_0319_000_0000;The Churches and Opposition to National Socialism;8/319;English
cho_meet_1934_0320_000_0000;The Balance of Armed Forces in Imperial Defence;8/320;English
cho_meet_1934_0321_000_0000;Russia, Germany and the Baltic States;8/321;English
cho_meet_1934_0322_000_0000;The Political Situation in France;8/322;English
cho_meet_1934_0323_000_0000;Germany, France and the Problem of the SAAR;8/323;English
cho_meet_1934_0324_000_0000;Democracy Since the War and its Prospects for the Future;8/324;English
cho_meet_1934_0325_000_0000;Chinese Impressions;8/325;English
cho_meet_1934_0326_000_0000;Egypt: Palace Government and British Policy;8/326;English
