cho_meet_1949_1654_000_0000;Human Relations in Africa;8/1654;English
cho_meet_1949_1655_000_0000;America and Power Politics;8/1655;English
cho_meet_1949_1656_000_0000;Arab Refugees;8/1656;English
cho_meet_1949_1657_000_0000;Brazil;8/1657;English
cho_meet_1949_1658_000_0000;Anglo-Irish Relations;8/1658;English
cho_meet_1949_1659_000_0000;Sea Power and the Atom Bomb;8/1659;English
cho_meet_1949_1660_000_0000;British Policy in South East Asia;8/1660;English
cho_meet_1949_1661_000_0000;The Soviet Armed Forces;8/1661;English
cho_meet_1949_1662_000_0000;Indonesia;8/1662;English
cho_meet_1949_1663_000_0000;Some Testing Points of Civilization in South West Africa;8/1663;English
cho_meet_1949_1664_000_0000;A Communist China: Problems at Home and Abroad;8/1664;English
cho_meet_1949_1665_000_0000;Soviet Methods of Interrogation;8/1665;English
cho_meet_1949_1666_000_0000;Strategy of the Arctic;8/1666;English
cho_meet_1949_1667_000_0000;Observations on Colonial Planning;8/1667;English
cho_meet_1949_1668_000_0000;Constitutional Developments in Malta;8/1668;English
cho_meet_1949_1669_000_0000;The Influence of Broadcasting in Germany;8/1669;English
cho_meet_1949_1670_000_0000;The State of Israel;8/1670;English
cho_meet_1949_1671_000_0000;Future Association Within the Commonwealth;8/1671;English
cho_meet_1949_1672_000_0000;Western Germany Since Currency Reform;8/1672;English
cho_meet_1949_1673_000_0000;Spain: A Survey;8/1673;English
cho_meet_1949_1674_000_0000;Loyalty to the United Nations;8/1674;English
cho_meet_1949_1675_000_0000;Communism and the Churches Today;8/1675;English
cho_meet_1949_1676_000_0000;Economic Developments in Western Germany;8/1676;English
cho_meet_1949_1677_000_0000;“European Reactions to the Marshall Plan”;8/1677;English
cho_meet_1949_1678_000_0000;Denmark: its Foreign Policy and International Position;8/1678;English
cho_meet_1949_1679_000_0000;Western Union;8/1679;English
cho_meet_1949_1680_000_0000;The Ruhr Statute in German Eyes;8/1680;English
cho_meet_1949_1681_000_0000;Gradual Revolution in Bulgaria and Rumania;8/1681;English
cho_meet_1949_1682_000_0000;Administration in Cyprus;8/1682;English
cho_meet_1949_1683_000_0000;Sweden and the Atlantic Pact;8/1683;English
cho_meet_1949_1684_000_0000;The Outlook for Europe;8/1684;English
cho_meet_1949_1685_000_0000;The Economic Relations of the United Kingdom and the Commonwealth;8/1685;English
cho_meet_1949_1686_000_0000;The Situation in the West Indies;8/1686;English
cho_meet_1949_1687_000_0000;Czechoslovakia: The Impact of the Soviet Union on a Social Democracy;8/1687;English
cho_meet_1949_1688_000_0000;Germany on the Eve of the Conference;8/1688;English
cho_meet_1949_1689_000_0000;Iraq as a Middle East Granary;8/1689;English
cho_meet_1949_1690_000_0000;Australia and South-East Asia;8/1690;English
cho_meet_1949_1691_000_0000;The Colonial Development Corporation;8/1691;English
cho_meet_1949_1692_000_0000;How Many South Africas?;8/1692;English
cho_meet_1949_1693_000_0000;Britain, the Communists and South East Asia;8/1693;English
cho_meet_1949_1694_000_0000;Portugal;8/1694;English
cho_meet_1949_1695_000_0000;World Government - in Whose Time?;8/1695;English
cho_meet_1949_1696_000_0000;Tito and the Cominform;8/1696;English
cho_meet_1949_1697_000_0000;Anglo-Canadian Trade;8/1697;English
cho_meet_1949_1698_000_0000;New found land;8/1698;English
cho_meet_1949_1699_000_0000;Reflexions Sur Les Origines Des Guerres Mondiales Contemporaines;8/1699;French
cho_meet_1949_1700_000_0000;The Church in Relation to International Affairs;8/1700;English
cho_meet_1949_1701_000_0000;Contemporary Forms of Association of States;8/1701;English
cho_meet_1949_1702_000_0000;The British Commonwealth;8/1702;English
cho_meet_1949_1703_000_0000;The Four Power Talks;8/1703;English
cho_meet_1949_1704_000_0000;Australia in 1949;8/1704;English
cho_meet_1949_1705_000_0000;Kingdom of the Jordan?;8/1705;English
cho_meet_1949_1706_000_0000;Greece in the Spring of 1949;8/1706;English
cho_meet_1949_1707_000_0000;Some Aspects of the Education of the African Native;8/1707;English
cho_meet_1949_1708_000_0000;Indian Ocean Relations;8/1708;English
cho_meet_1949_1709_000_0000;The Rhodesian Outlook;8/1709;English
cho_meet_1949_1710_000_0000;The Food Problems of India and Pakistan;8/1710;English
cho_meet_1949_1711_000_0000;The Shape of the New India;8/1711;English
cho_meet_1949_1712_000_0000;Recent Impressions of Spain;8/1712;English
cho_meet_1949_1713_000_0000;China;8/1713;English
cho_meet_1949_1714_000_0000;Some Impressions of Argentina;8/1714;English
cho_meet_1949_1715_000_0000;Developments in the Sudan;8/1715;English
cho_meet_1949_1716_000_0000;Education in Germany;8/1716;English
cho_meet_1949_1717_000_0000;Impressions of Iraq, 1947 to 1949;8/1717;English
cho_meet_1949_1718_000_0000;The Foreign Relations of the Anti-Hitler Plot in Germany;8/1718;English
cho_meet_1949_1719_000_0000;Race Relations in South Africa;8/1719;English
cho_meet_1949_1720_000_0000;The Council of Europe;8/1720;English
cho_meet_1949_1721_000_0000;The Holy Places of Palestine in History and in Politics (Discussion Only);8/1721;English
cho_meet_1949_1722_000_0000;China: Report of a Visit;8/1722;English
cho_meet_1949_1723_000_0000;The Strategy and Resources of Africa South of the Sahara;8/1723;English
cho_meet_1949_1724_000_0000;L'Union Francaise;8/1724;French
cho_meet_1949_1725_000_0000;The Present Situation in Colombia;8/1725;English
cho_meet_1949_1726_000_0000;Impressions of South America;8/1726;English
cho_meet_1949_1727_000_0000;Mission to the Soviet Union;8/1727;English
cho_meet_1949_1728_000_0000;Fourth British Commonwealth Relations Conference;8/1728;English
cho_meet_1949_1729_000_0000;The International Trade Union Movement;8/1729;English
cho_meet_1949_1730_000_0000;An American Outlook on Foreign Affairs Today;8/1730;English
cho_meet_1949_1731_000_0000;The Soviet-Yugoslav Dispute;8/1731;English
cho_meet_1949_1732_000_0000;Problems of the Jewish Community Outside Israel;8/1732;English
cho_meet_1949_1733_000_0000;The Soviet People to a Westerner;8/1733;English
cho_meet_1949_1734_000_0000;Un-American Activities in the U. S. A.;8/1734;English
cho_meet_1949_1735_000_0000;South Africa After Sixteen Years;8/1735;English
cho_meet_1949_1736_000_0000;The Agrarian Situation in Italy;8/1736;English
cho_meet_1949_1737_000_0000;Far Eastern Group: Political Development in Ceylon;8/1737;English
cho_meet_1949_1738_000_0000;Far Eastern Group: Siam;8/1738;English
cho_meet_1949_1739_000_0000;Far Eastern Group: Indonesia and Communism;8/1739;English
cho_meet_1949_1740_000_0000;Far Eastern Group: Trades Unions in Malaya;8/1740;English
cho_meet_1949_1741_000_0000;Far Eastern Group: Hong Kong and South China;8/1741;English
cho_meet_1949_1743_000_0000;Far Eastern Group: The Struggle in Malaya;8/1743;English
cho_meet_1949_1744_000_0000;Far Eastern Group: China in 1949;8/1744;English
cho_meet_1949_1745_000_0000;Far Eastern Group: The Secession of Penang Settlement;8/1745;English
cho_meet_1949_1746_000_0000;Far Eastern Group: American Policy in the Far East;8/1746;English
cho_meet_1949_1747_000_0000;Far Eastern Group: Forces for Unity in Malaya;8/1747;English
cho_meet_1949_1748_000_0000;Far Eastern Group: Sarawak;8/1748;English
cho_meet_1949_1749_000_0000;Far Eastern Group: Korea 1915-1949: Changes and Prospects;8/1749;English
cho_meet_1949_1750_000_0000;Far Eastern Group: British Policy in the Far East;8/1750;English
cho_meet_1949_1751_000_0000;Far Eastern Group: The Situation in Japan;8/1751;English
cho_meet_1949_1752_000_0000;Far Eastern Group: Population Movements and Some Economic Developments in the Far East;8/1752;English
cho_meet_1949_1753_000_0000;Far Eastern Group: Ceylon: Some Reflections on the Working of the New Constitution;8/1753;English
cho_meet_1949_1754_000_0000;Far Eastern Group: The Population Problem in Japan;8/1754;English
cho_meet_1949_1755_000_0000;Far Eastern Group: Political Developments in Japan;8/1755;English
cho_meet_1949_1756_000_0000;Far Eastern Group: Labour and Democracy in Japan;8/1756;English
cho_meet_1949_1757_000_0000;Far Eastern Group: Indonesia and the Hague Conference;8/1757;English
cho_meet_1949_1758_000_0000;Far Eastern Group: Personal Impressions of Chinese Communist Rule in Nanking and Shanghai;8/1758;English
cho_meet_1949_1759_000_0000;Middle East Group: Constitutional Development in Syria and the Lebanon;8/1759;English
cho_meet_1949_1760_000_0000;Middle East Group: The Fate of Arabdom - a Study in Comparative Nationalism;8/1760;English
cho_meet_1949_1761_000_0000;Middle East Group: Jerusalem Today;8/1761;English
cho_meet_1949_1762_000_0000;Middle East Group: Education in Egypt Today;8/1762;English
cho_meet_1949_1763_000_0000;Middle East Group: The Situation in Kurdistan To-Day;8/1763;English
cho_meet_1949_1764_000_0000;Middle East Group: Persia;8/1764;English
cho_meet_1949_1765_000_0000;Middle East Group: The Lebanon, Syria and Iraq, 1948-49;8/1765;English
cho_meet_1949_1766_000_0000;Middle East Group: Hints About the Religious Factor in the Middle East;8/1766;English
cho_meet_1949_1767_000_0000;Middle East Group: Borderlands of Oman;8/1767;English
cho_meet_1949_1768_000_0000;Middle East Group: Cairo to Johannesburg: Impressions of a Recent Journey With Special Attention to Racial Relations;8/1768;English
cho_meet_1949_1769_000_0000;Middle East Group: Recent Political Trends in Persia;8/1769;English
cho_meet_1950_1770_000_0000;France: A Survey of Recent Events;8/1770;English
cho_meet_1950_1771_000_0000;Greece Relapse or Recovery?;8/1771;English
cho_meet_1950_1772_000_0000;The day-to-day Economy of Germany;8/1772;English
cho_meet_1950_1773_000_0000;The Dollar-Sterling Problem;8/1773;English
cho_meet_1950_1774_000_0000;Titoism and the Cominform;8/1774;English
cho_meet_1950_1775_000_0000;The Recovery of German Exports;8/1775;English
cho_meet_1950_1776_000_0000;Present Tendencies in Poland;8/1776;English
cho_meet_1950_1777_000_0000;Political Development of Labour in the United States;8/1777;English
cho_meet_1950_1778_000_0000;Review of the United Nations Assembly, 1949;8/1778;English
cho_meet_1950_1779_000_0000;Middle East Group:Impressions of a Two Months' Journey in India and Pakistan;8/1779;English
cho_meet_1950_1780_000_0000;Albania : An Isolated Satellite;8/1780;English
cho_meet_1950_1781_000_0000;The Internationalization of Jerusalem;8/1781;English
cho_meet_1950_1782_000_0000;The Peasantry of S. E. Asia;8/1782;English
cho_meet_1950_1783_000_0000;The Decline of Freedom in Czechoslovakia:With Special Reference to the Press and Other Methods of Information;8/1783;English
cho_meet_1950_1784_000_0000;The Chinese Communist Government and the Merits of Recognition;8/1784;English
cho_meet_1950_1785_000_0000;Germany: The Insoluble Problem;8/1785;English
cho_meet_1950_1786_000_0000;The British Interest in Germany in the Next Ten Years;8/1786;English
cho_meet_1950_1787_000_0000;The International Socialist Conference , 1946-50;8/1787;English
cho_meet_1950_1788_000_0000;Impressions of Finland and its Problems;8/1788;English
cho_meet_1950_1789_000_0000;Life in Vienna;8/1789;English
cho_meet_1950_1790_000_0000;Belgium: A Survey of Recent Events;8/1790;English
cho_meet_1950_1791_000_0000;Asia's Food Problems and Their Impact on the Western Countries;8/1791;English
cho_meet_1950_1792_000_0000;Norway and World Affairs;8/1792;English
cho_meet_1950_1793_000_0000;Benelux Seen From Belgium;8/1793;English
cho_meet_1950_1794_000_0000;The Colombo Conference;8/1794;English
cho_meet_1950_1795_000_0000;The Church in South India;8/1795;English
cho_meet_1950_1796_000_0000;Communist Technique in Poland;8/1796;English
cho_meet_1950_1797_000_0000;The Jewish Migration from the Yemen and Aden;8/1797;English
cho_meet_1950_1798_000_0000;The Situation in the West Indies;8/1798;English
cho_meet_1950_1799_000_0000;Manners and Morals in Russia Today;8/1799;English
cho_meet_1950_1800_000_0000;Impressions of a Short Visit to Pakistan and India;8/1800;English
cho_meet_1950_1801_000_0000;Burma Today;8/1801;English
cho_meet_1950_1802_000_0000;The Sterling/Dollar Problem;8/1802;English
cho_meet_1950_1803_000_0000;Uncertain Japan;8/1803;English
cho_meet_1950_1804_000_0000;Race Relations in the Commonwealth;8/1804;English
cho_meet_1950_1805_000_0000;Atlantic Union and the U. S. A.;8/1805;English
cho_meet_1950_1806_000_0000;The Problem of the Displaced Persons;8/1806;English
cho_meet_1950_1807_000_0000;Malaya as it is Today;8/1807;English
cho_meet_1950_1808_000_0000;Current Problems of Italy;8/1808;English
cho_meet_1950_1809_000_0000;The U.S.S.R. and the United Nations;8/1809;English
cho_meet_1950_1810_000_0000;Israel and the Middle East;8/1810;English
cho_meet_1950_1811_000_0000;Recent Economic Developments in India;8/1811;English
cho_meet_1950_1812_000_0000;A Turning-Point in the Cold War?;8/1812;English
cho_meet_1950_1813_000_0000;East Bengal since 1947;8/1813;English
cho_meet_1950_1814_000_0000;Report on Full Employment;8/1814;English
cho_meet_1950_1815_000_0000;The American Stake in Europe: Retrospect and Prospect;8/1815;English
cho_meet_1950_1816_000_0000;The Rearmament of Germany a Discussion;8/1816;English
cho_meet_1950_1817_000_0000;Some Problems of Economic Co-Operation;8/1817;English
cho_meet_1950_1818_000_0000;South Africa Today: An Australian View;8/1818;English
cho_meet_1950_1819_000_0000;British Foreign Policy Since 1945;8/1819;English
cho_meet_1950_1820_000_0000;Economic Developments in East Africa;8/1820;English
cho_meet_1950_1821_000_0000;Hydrogen Bombs: The Need for a Policy;8/1821;English
cho_meet_1950_1822_000_0000;International Collaboration in Health;8/1822;English
cho_meet_1950_1823_000_0000;An American Looks at Europe;8/1823;English
cho_meet_1950_1824_000_0000;Problems of South-East Asia;8/1824;English
cho_meet_1950_1825_000_0000;Industrial Development in India;8/1825;English
cho_meet_1950_1826_000_0000;Labour Conditions in the Iranian Oil Industry;8/1826;English
cho_meet_1950_1827_000_0000;Methods of Soviet Domination in Satellite States;8/1827;English
cho_meet_1950_1828_000_0000;The United Nations in October 1950;8/1828;English
cho_meet_1950_1829_000_0000;Korea and Asia;8/1829;English
cho_meet_1950_1830_000_0000;The Partisans of Peace;8/1830;English
cho_meet_1950_1831_000_0000;European Defence;8/1831;English
cho_meet_1950_1832_000_0000;The Status of Modern Warfare;8/1832;English
cho_meet_1950_1833_000_0000;Second Stevenson Memorial Lecture;8/1833;English
cho_meet_1950_1834_000_0000;The Council of Europe;8/1834;English
cho_meet_1950_1835_000_0000;Locust Problem in its International Aspects;8/1835;English
cho_meet_1950_1836_000_0000;Impressions of a Recent Tour of Southeast Asia;8/1836;English
cho_meet_1950_1837_000_0000;United Nations Action in the Matter of Korea ,and its Possible Implications;8/1837;English
cho_meet_1950_1838_000_0000;Bulgaria Today;8/1838;English
cho_meet_1950_1839_000_0000;Point Four;8/1839;English
cho_meet_1950_1840_000_0000;European Payments Union;8/1840;English
cho_meet_1950_1841_000_0000;British Colonial Policy;8/1841;English
cho_meet_1950_1842_000_0000;The Eleventh Conference of the Institute of Pacific Relations;8/1842;English
cho_meet_1950_1844_000_0000;South America;8/1844;English
cho_meet_1950_1847_000_0000;China and the Crisis;8/1847;English
cho_meet_1950_1848_000_0000;The Commonwealth and World Affairs;8/1848;English
cho_meet_1950_1849_000_0000;Far Eastern Group: Recent Developments in the Far East;8/1849;English
cho_meet_1950_1850_000_0000;Far Eastern Group: Japan's Peace Mind;8/1850;English
cho_meet_1950_1851_000_0000;Far Eastern Group: Defence Problems in South East Asia;8/1851;English
cho_meet_1950_1852_000_0000;Far Eastern Group: The Chinese Communist Puzzle;8/1852;English
cho_meet_1950_1853_000_0000;Far Eastern Group: Some Economic Aspects of Recent Developments in China;8/1853;English
cho_meet_1950_1854_000_0000;Far Eastern Group: The Situation in Indo-China;8/1854;English
cho_meet_1950_1855_000_0000;Far Eastern Group: The Kailan Mining Administration and the Communists;8/1855;English
cho_meet_1950_1856_000_0000;Far Eastern Group: The Entrepot of Singapore;8/1856;English
cho_meet_1950_1857_000_0000;Far Eastern Group: Moscow Radio's Picture of the Far East;8/1857;English
cho_meet_1950_1858_000_0000;Far Eastern Group: Some Impressions of Japanese Economic Recovery;8/1858;English
cho_meet_1950_1859_000_0000;Far Eastern Group: Communist China as seen from Peking;8/1859;English
cho_meet_1950_1860_000_0000;Far Eastern Group: China;8/1860;English
cho_meet_1950_1861_000_0000;Far Eastern Group: Federalism and Unitarianism in Indonesia;8/1861;English
cho_meet_1950_1862_000_0000;Far Eastern Group: Aspects of Communist China;8/1862;English
cho_meet_1950_1863_000_0000;Far Eastern Group: Persons and Politics in Malaya;8/1863;English
cho_meet_1950_1864_000_0000;Far Eastern Group: China as seen from the Angle of the British Council;8/1864;English
cho_meet_1950_1865_000_0000;Far Eastern Group: The Recent Recovery of Japanese Economy and its Relation to East Asia;8/1865;English
cho_meet_1950_1866_000_0000;Far Eastern Group: Trade Unions in South-East Asia;8/1866;English
cho_meet_1950_1867_000_0000;Far Eastern Group: Sarawak: Social and Economic Developments;8/1867;English
cho_meet_1950_1868_000_0000;Far Eastern Group: China, a Question Mark;8/1868;English
cho_meet_1950_1869_000_0000;Far Eastern Group: Recent Visit to Malaya;8/1869;English
cho_meet_1950_1871_000_0000;Middle East Group: Iraq- the Fringe of the Curtain;8/1871;English
cho_meet_1950_1872_000_0000;Middle East Group: Coup and Counter-Coup in Syria;8/1872;English
cho_meet_1950_1873_000_0000;Middle East Group: The Work of the United Nations Economic Survey Mission to the Middle East;8/1873;English
cho_meet_1950_1874_000_0000;Middle East Group: Child Welfare in Israel;8/1874;English
cho_meet_1950_1875_000_0000;Middle East Group: Israel from the Mandate Until Today;8/1875;English
cho_meet_1950_1876_000_0000;Middle East Group: The Responsibilities of Middle East Land Forces;8/1876;English
cho_meet_1950_1877_000_0000;Middle East Group: Truman's Fourth Point and the Middle East;8/1877;English
cho_meet_1950_1878_000_0000;Middle East Group: The Cyprus Question;8/1878;English
cho_meet_1950_1879_000_0000;The Government of Israel from Within;8/1879;English
cho_meet_1950_1880_000_0000;Middle East Group: Labour Developments in Turkey;8/1880;English
cho_meet_1950_1881_000_0000;Middle East Group: Report from Israel, With Special Reference to Immigration;8/1881;English
cho_meet_1950_1882_000_0000;Middle East Group: The Recent Turkish Elections and the Future of Party Politics in Turkey;8/1882;English
cho_meet_1950_1883_000_0000;Middle East Group: Some Aspects of Iraqi Affairs;8/1883;English
cho_meet_1950_1884_000_0000;Middle East Group: The Former Italian Colonies;8/1884;English
cho_meet_1950_1885_000_0000;Middle East Group: Egypt Today;8/1885;English
cho_meet_1950_1889_000_0000;African Group: African Problems;8/1889;English
cho_meet_1950_1890_000_0000;African Group: The African as a Producer;8/1890;English
cho_meet_1950_1891_000_0000;African Group: The Union of South Africa and its Neighbours;8/1891;English
cho_meet_1950_1892_000_0000;African Group: Nigeria Today;8/1892;English
cho_meet_1950_1894_000_0000;Special: World Government;8/1894;English
cho_meet_1951_1843_000_0000;Some Aspects of International Economic Integration;8/1843;English
cho_meet_1951_1845_000_0000;Some Factors in Soviet Policy-Making;8/1845;English
cho_meet_1951_1846_000_0000;The Colombo Plan;8/1846;English
cho_meet_1951_1870_000_0000;Far Eastern Group: Burma;8/1870;English
cho_meet_1951_1886_000_0000;Middle East Group: The Trucial Coast: Its Peoples and Problems;8/1886;English
cho_meet_1951_1887_000_0000;Middle East Group: Economic Conditions in Israel;8/1887;English
cho_meet_1951_1893_000_0000;African Group: Standards of Living as a Political Weapon;8/1893;English
cho_meet_1951_1896_000_0000;German Rearmament;8/1896;English
cho_meet_1951_1897_000_0000;The United Nations' Technical Assistance Mission to Bolivia;8/1897;English
cho_meet_1951_1898_000_0000;The Work of the 5th General Assembly of the United Nations;8/1898;English
cho_meet_1951_1899_000_0000;The Growth of Society in the Middle East;8/1899;English
cho_meet_1951_1900_000_0000;India's Northern Boundary;8/1900;English
cho_meet_1951_1901_000_0000;Impressions of Yugoslavia;8/1901;English
cho_meet_1951_1902_000_0000;Korea-Impressions and Reflections;8/1902;English
cho_meet_1951_1903_000_0000;The Scientific Council for Africa South of the Sahara;8/1903;English
cho_meet_1951_1904_000_0000;Yugoslav-Soviet Relations;8/1904;English
cho_meet_1951_1905_000_0000;International Financial Relations: Some Concealed Problems;8/1905;English
cho_meet_1951_1906_000_0000;China and Communism;8/1906;English
cho_meet_1951_1907_000_0000;The Refugee Problem in the Light of Recent U. N. Action;8/1907;English
cho_meet_1951_1908_000_0000;Some Aspects of Italy Today;8/1908;English
cho_meet_1951_1909_000_0000;Politics, Opinion and Feeling in America in the Present Crisis;8/1909;English
cho_meet_1951_1910_000_0000;Atlantic Union;8/1910;English
cho_meet_1951_1911_000_0000;Soviet Policy in China;8/1911;English
cho_meet_1951_1912_000_0000;The Changing Scene in Yugoslavia;8/1912;English
cho_meet_1951_1913_000_0000;Christian Life Behind the Iron Curtain;8/1913;English
cho_meet_1951_1914_000_0000;Germany and Europe;8/1914;English
cho_meet_1951_1915_000_0000;Recent Developments in Turkey;8/1915;English
cho_meet_1951_1916_000_0000;Indo-China;8/1916;English
cho_meet_1951_1917_000_0000;India and Pakistan Today;8/1917;English
cho_meet_1951_1918_000_0000;The Fifties as Seen Fifty Years Hence;8/1918;English
cho_meet_1951_1919_000_0000;The American Economy;8/1919;English
cho_meet_1951_1920_000_0000;The Principles of Tribal Administration;8/1920;English
cho_meet_1951_1921_000_0000;The Structure of Society in Israel;8/1921;English
cho_meet_1951_1922_000_0000;Great Britain and Egypt: A Reconsideration;8/1922;English
cho_meet_1951_1923_000_0000;Present Developments in Schleswig-Holstein;8/1923;English
cho_meet_1951_1924_000_0000;The Swedish Position;8/1924;English
cho_meet_1951_1925_000_0000;Finland's Position Today;8/1925;English
cho_meet_1951_1926_000_0000;German Financial Policy Under Strain;8/1926;English
cho_meet_1951_1927_000_0000;Repercussions of the S. E. D. Purge;8/1927;English
cho_meet_1951_1928_000_0000;Austria Six Years After Her Liberation;8/1928;English
cho_meet_1951_1929_000_0000;The Gold Coast: Pattern for Africa?;8/1929;English
cho_meet_1951_1930_000_0000;Barcelona after the strike;8/1930;English
cho_meet_1951_1931_000_0000;French Opinion and the Atlantic Treaty;8/1931;English
cho_meet_1951_1932_000_0000;Commonwealth Policies in Asia and the Pacific;8/1932;English
cho_meet_1951_1933_000_0000;Events in Persia;8/1933;English
cho_meet_1951_1934_000_0000;British Trade Union Structure with Some Foreign Comparisons;8/1934;English
cho_meet_1951_1935_000_0000;Ceylon and the Task that Lies Ahead;8/1935;English
cho_meet_1951_1936_000_0000;The Strasbourg Assembly;8/1936;English
cho_meet_1951_1937_000_0000;The Impact of the new constitution on the Indian Economy;8/1937;English
cho_meet_1951_1938_000_0000;Towards Atlantic Security;8/1938;English
cho_meet_1951_1939_000_0000;Australian Foreign Policy in South East Asia;8/1939;English
cho_meet_1951_1940_000_0000;Possibilities Open to Foreign Capital in Pakistan;8/1940;English
cho_meet_1951_1941_000_0000;The Scientific Versus the Moralistic Approach in International Affairs;8/1941;English
cho_meet_1951_1942_000_0000;The German Economic Scene;8/1942;English
cho_meet_1951_1943_000_0000;Three Years of Israel;8/1943;English
cho_meet_1951_1944_000_0000;The Communal Elections in Italy;8/1944;English
cho_meet_1951_1945_000_0000;Financial and Economic Developments in Egypt;8/1945;English
cho_meet_1951_1946_000_0000;The Paris Four Power Conference;8/1946;English
cho_meet_1951_1947_000_0000;Technical Assistance: Programmes and Policies;8/1947;English
cho_meet_1951_1948_000_0000;The American Parties and Foreign Policy;8/1948;English
cho_meet_1951_1949_000_0000;Popular Revolution in Latin America;8/1949;English
cho_meet_1951_1950_000_0000;The Allocation of Raw Materials, in Particular the Problem of Coal;8/1950;English
cho_meet_1951_1951_000_0000;Food Production Problems in India;8/1951;English
cho_meet_1951_1952_000_0000;Two Years of India;8/1952;English
cho_meet_1951_1953_000_0000;Some Aspects of Soviet/German Relations;8/1953;English
cho_meet_1951_1954_000_0000;Impressions of Spain;8/1954;English
cho_meet_1951_1955_000_0000;The Strategic Thinking of the U. S. A.;8/1955;English
cho_meet_1951_1956_000_0000;Dollar Exports in the Marshall Plan Period;8/1956;English
cho_meet_1951_1957_000_0000;The Quaker Mission to the U. S. S. R.;8/1957;English
cho_meet_1951_1958_000_0000;The Soviet Peace Campaign;8/1958;English
cho_meet_1951_1959_000_0000;Problems of Production for Defence;8/1959;English
cho_meet_1951_1960_000_0000;Germany and Europe;8/1960;English
cho_meet_1951_1961_000_0000;India and her Frontiers;8/1961;English
cho_meet_1951_1962_000_0000;Some Reflections on Problems Connected with the High Commission Territories;8/1962;English
cho_meet_1951_1963_000_0000;The Fabric of American Opinion on Foreign Affairs;8/1963;English
cho_meet_1951_1965_000_0000;Some Recent Personal Impressions of the U. S. S. R.;8/1965;English
cho_meet_1951_1966_000_0000;The Decline of Europe in the Middle East;8/1966;English
cho_meet_1951_1967_000_0000;A Turning Point in Colonial Rule;8/1967;English
cho_meet_1951_1969_000_0000;Germany and the Problems of Our Time;8/1969;English
cho_meet_1951_1971_000_0000;“India's Domestic and International Attitudes – a Paradox?”;8/1971;English
cho_meet_1951_1972_000_0000;The Sterling Area;8/1972;English
cho_meet_1951_1973_000_0000;Far Eastern Group: Siam and South East Asia;8/1973;English
cho_meet_1951_1974_000_0000;Far Eastern Group: The Netherlands Indonesian Union;8/1974;English
